"author","title","link"
"R' Eliyahu Hartman ZTL","Soul to Soul: Parashat Lech Lecha: Tefillah - In Search of Oneness with Ribono Shel Olam","https://www.torahanytime.com/lectures/210930"
"R' Avrohom Stulberger","It's in our Blood - Lech Lecha 5783","https://www.torahanytime.com/lectures/210926"
"R' Label Lam","Parashat Lech Lecha - Avraham Heard It!","https://www.torahanytime.com/lectures/210928"
"R' Moshe Meir Weiss","For the Shabbos Table Lech Lcha 5783","https://www.torahanytime.com/lectures/210918"
"R' Yosef Greenwald","Lomdus Al Haparsha-What Does Mitzrayim Have to do with Hatzalah on Shabbos","https://www.torahanytime.com/lectures/210917"
"R' Daniel Glatstein","Pninei Maggid Harakiah - 7 Original Short Divrei Torah on Lech Lecha {& How To See in Print}","https://www.torahanytime.com/lectures/210913"
"R' Daniel Glatstein","Lech Lecha : The Kabbalistic Significance of Avraham's 318 Men & the Power of Barchu","https://www.torahanytime.com/lectures/210914"
"R' Daniel Glatstein","""Fasten Your Seatbelts"" - 7 Imponderables on Parashat Lech Lecha","https://www.torahanytime.com/lectures/210915"
"R' Michael Mansour","Parashat Lech Lecha: A Wall In Serving Hashem","https://www.torahanytime.com/lectures/210906"
"R' Elchonon Jacobovitz","Parashat Lech Lecha: The Yeshiva Shmuz","https://www.torahanytime.com/lectures/210911"
"R' Yosef Radner","Lech Lecha","https://www.torahanytime.com/lectures/210908"
"R' Pesach Siegel","Parashat Lech Lecha - Emuna Is Not Just A Feeling... It Is A Creation","https://www.torahanytime.com/lectures/210891"
"R' Ariel Mizrahi","Hamsa and the Evil Eye","https://www.torahanytime.com/lectures/210885"
"R' Shraga Kallus","Parshat Lech Lecha: Hospital Staff In My Stomach","https://www.torahanytime.com/lectures/210871"
"R' Doniel Osher Kleinman","Parashat Lech Lecha: Tefillin - Oft Overlooked Halachos","https://www.torahanytime.com/lectures/210867"
"R' Shraga Kallus","Parshat Lech Lecha: Lamah Lamah Lamah.......","https://www.torahanytime.com/lectures/210863"
"R' Motti Kesserman","לֶךְ־לְךָ֛! וֶֽהְיֵ֖ה בְּרָכָֽה! Your uniqueness will bring brocho!","https://www.torahanytime.com/lectures/210861"
"R' Chaim Eisenstein","Lech Lecha: Where Are You Going?","https://www.torahanytime.com/lectures/210858"
"R' Ari Goldwag","Lech Lecha: Two Halves of a Whole","https://www.torahanytime.com/lectures/210848"
"R' Fischel Schachter","Parashat Lech Lecha: Ohr HaChaim - When Zaidy Came To Visit","https://www.torahanytime.com/lectures/210828"
"R' Leiby Burnham","Lech Lecha - Hagar 101","https://www.torahanytime.com/lectures/210826"
"R' Tzvi Sytner","Lech Lecha: Don't Say One Day, Say Day One!","https://www.torahanytime.com/lectures/210829"
"R' Moshe Don Kestenbaum","Parashat Lech Lecha: Lessons From Sedom","https://www.torahanytime.com/lectures/210831"
"R' Yosef Greenwald","Daas Tevunos(44-46)-The World of Hashem's Perfection in the Eyes of Avraham Avinu","https://www.torahanytime.com/lectures/210830"
"R' Motti Neuburger","Lech-Lecha Gems","https://www.torahanytime.com/lectures/210825"
"R' Daniel Kalish","Lech lecha: Our Challenges Make Us [Remembering Eli & Dani A""H]","https://www.torahanytime.com/lectures/210823"
"R' Baruch Bodenheim","Parashat Lech Lecha: Seeing and Being Seen","https://www.torahanytime.com/lectures/210821"
"R' Zvi Zimmerman","Parashat Lech Lecha: Sarai and Paroh - hit for a reason (5783)","https://www.torahanytime.com/lectures/210818"
"R' Avi Slansky","Lech Lecha: Revealing YOUR INNER LIGHT!!","https://www.torahanytime.com/lectures/210816"
"R' Labish Becker","Lech Le’cha 5783 - Preventing Affluenza","https://www.torahanytime.com/lectures/210817"
"R' Yehuda Mandel","World of Navardok 2-Lech Lecha 5783","https://www.torahanytime.com/lectures/210804"
"R' Shlomo Cynamon","Lomdut on Lech Lecha: Avrham Avinu, R. Aron of Belz & Pikuach Nefesh","https://www.torahanytime.com/lectures/210801"
"R' Yehoshua Landau","Avraham,Still Relevant In Our Lives?","https://www.torahanytime.com/lectures/210794"
"R' Motti Neuburger","The Progression of the Spiritual Downfall of the Enigmatic Lot","https://www.torahanytime.com/lectures/210797"
"R' Yosef Chaim Schwab","Parashat lech lecha: The Secret of the 4 Powers and 5 Powers of Your Daily Life","https://www.torahanytime.com/lectures/210791"
"R' Yosef Chaim Schwab","Parashat Lech Lecha: The Secret of Avraham's 100 Year Buisiness Trip","https://www.torahanytime.com/lectures/210788"
"R' Yosef Chaim Schwab","Parashat Lech Lecha: The Secret Behind the 2 Millionaires Splitting the country 2% to 98%","https://www.torahanytime.com/lectures/210790"
"R' Yosef Chaim Schwab","Parashat Lech lecha: The Secret of the Forged Ramban","https://www.torahanytime.com/lectures/210789"
"R' Shlomo Landau","Practical Parsha Perspectives Lech Lecha; The Eternal Fiber of Am Yisrael","https://www.torahanytime.com/lectures/210785"
"R' Dovid Eisenberg","Trying to understand Lot","https://www.torahanytime.com/lectures/210774"
"R' Asher Weiss","Parshat Lech Lecha: Chazaka Regarding Bris Milah","https://www.torahanytime.com/lectures/210767"
"R' Avrohom Snyder","The gift of the Ten Nisyonot","https://www.torahanytime.com/lectures/210760"
"R' Gabi Fried","Cognitive Dissonance!!!","https://www.torahanytime.com/lectures/210756"
"R' Yaakov Harari","Lech lecha - against all logic","https://www.torahanytime.com/lectures/210759"
"R' Shraga Kallus","Parshat Lech Lecha: Mizrahi Kid On The Hood Of My Car!","https://www.torahanytime.com/lectures/210758"
"R' Avrohom Stulberger","Parenting Secrets from Parashat Lech Lecha 5783","https://www.torahanytime.com/lectures/210748"
"R' Jeremy Golker","Parsha Shiur: Lech Lecha","https://www.torahanytime.com/lectures/210741"
"R' Meir Simcha Sperling","The Man Who Jumped, The Lawyer Who Charged Too Much And The Boy Who Lived (The Power Of Words)","https://www.torahanytime.com/lectures/210730"
"R' Yosef Palacci","Parashat Lech Lecha - The Ultimate 4 Major Impact","https://www.torahanytime.com/lectures/210727"
"R' Meir Simcha Sperling","Never Ever Give Up Hope!!","https://www.torahanytime.com/lectures/210735"
"R' Daniel Glatstein","Secrets of Sefer Bereishit - Talkline With Zev Brenner","https://www.torahanytime.com/lectures/210733"
"R' Nosson Greenberg","Lech Lecha 5783- Four Jews Walk Into The Parsha","https://www.torahanytime.com/lectures/210739"
"R' Elazar Meisels","The Parshah You Never Knew: The Secret of Ur Kasdim","https://www.torahanytime.com/lectures/210710"
"R' Shay Schachter","Eretz Yisrael as a Vital Organ of the Jewish People","https://www.torahanytime.com/lectures/210719"
"R' Fischel Schachter","Parashat Lech Lecha","https://www.torahanytime.com/lectures/210707"
"R' Dovid Kaplan","Kosher Hitman","https://www.torahanytime.com/lectures/210695"
"R' Meir Kahane","Aish Kodesh- Lech Lecha, (Succos) 5702, Expanding My Relationship With Hashem (2021/22 Series- Enhanced)","https://www.torahanytime.com/lectures/210693"
"R' Shmuel Silber","Lech Lecha- Life is a Journey (Tehillim 119)","https://www.torahanytime.com/lectures/210678"
"R' Yisroel Apelbaum","וְאֶת־הַנֶּ֖פֶשׁ אֲשֶׁר־עָשׂ֣וּ בְחָ֑רָן! Torah effects change in your essence!","https://www.torahanytime.com/lectures/210683"
"R' Eliezer Simcha Lieff","Parashat Lech Lecha: Travel With A Purpose","https://www.torahanytime.com/lectures/210674"
"R' Shmuel Silber","Lech Lecha- Count the Stars","https://www.torahanytime.com/lectures/210676"
"R' Zev Leff","Parshat Lech Lecha: The Right Outlook","https://www.torahanytime.com/lectures/210657"
"R' Joey Haber","Parashat Lech Lecha: Brothers","https://www.torahanytime.com/lectures/210645"
"R' Moshe Meir Weiss","Parashat Lech lecha Gems","https://www.torahanytime.com/lectures/210642"
"R' Eliezer Ginsburg","Parashat Lech Lecha: Emunah","https://www.torahanytime.com/lectures/210646"
"R' Naftali Reich","Parashat Lech lecha: Baruch Hashem","https://www.torahanytime.com/lectures/210643"
"R' Chaim Rosenfeld","Parashat Lech Lecha","https://www.torahanytime.com/lectures/210640"
"R' Yerachmiel Milstein","Parashat Lech Lecha: Avraham Avinu - A Brilliantly Challenging Life","https://www.torahanytime.com/lectures/210639"
"R' Tzvi Sytner","Lech Lecha: From Impossible to Its-Possible!","https://www.torahanytime.com/lectures/210627"
"R' Ari Neuwirth","Lech Lecha - The Role of Pictures in Shiduchim","https://www.torahanytime.com/lectures/210628"
"R' Daniel Glatstein","Lech Lecha: The Wandering Jew - Meet the 4 Great All-Time Jewish Travelers","https://www.torahanytime.com/lectures/210625"
"R' Moshe Bamberger","Rav Schwab: Avraham's Masterstroke","https://www.torahanytime.com/lectures/210630"
"R' Eliezer Krohn","Pilpul On The Parshah Eating Before Shacharit","https://www.torahanytime.com/lectures/210621"
"R' Ari Bensoussan","Nesivas Yoisher- Parshat Lech Lecha- Whats Going on in Our Penimius?","https://www.torahanytime.com/lectures/210614"
"R' Shmuel Zucker","Parashat Lech Lecha: Revealing the Hidden World","https://www.torahanytime.com/lectures/210616"
"R' Yitzchak Sakhai","Parashat Lech Lecha - Leaving his father (Zera Shimshon Maamar 1)","https://www.torahanytime.com/lectures/210603"
"R' Yitzchok Aryeh Epstein","Parshat Lech Lecha like you have never heard before.","https://www.torahanytime.com/lectures/210600"
"R' Yisroel Brog","Parashat Lech Lecha - The Nisayon of Avrohom Avinu with Lot","https://www.torahanytime.com/lectures/210593"
"R' Yisroel Jungreis","Daven for Others","https://www.torahanytime.com/lectures/210570"
"R' Ezriel Cziment","The Remarkable Thing About Avrohom Avinu's 10 Nisayonos","https://www.torahanytime.com/lectures/210566"
"R' Ariel Mizrahi","318 or Eliezer?","https://www.torahanytime.com/lectures/210562"
"R' Ilan Halberstadt","Parashat Lech Lecha: Avraham Goes to War Just For Lot","https://www.torahanytime.com/lectures/210565"
"R' Avrohom M. Mendelson","Parshat Lech Lecha - Do you appreciate the Value of Learning Mussar?!""","https://www.torahanytime.com/lectures/210557"
"R' Dovid Lichtenstein","Parashat Lech Lecha - Struggles Can Draw Out Your Greatness (Excerpt from Halacha Headlines Shiur 245, 2019)","https://www.torahanytime.com/lectures/210552"
"R' Yaakov Asher Sinclair","Parashat Lech Lecha: Is It Better to Travel Hopefully?","https://www.torahanytime.com/lectures/210542"
"R' Dovid Kaplan","The Joy Of Travel","https://www.torahanytime.com/lectures/210534"
"R' Daniel Glatstein","Lech Lecha: Believe It Or Not {Chochmas Noshim}","https://www.torahanytime.com/lectures/210527"
"R' Yaakov Asher Sinclair","Parashat Lech Lecha","https://www.torahanytime.com/lectures/210524"
"R' Eliyahu Maksumov","Parashat Lech Lecha - Avraham Avinu & The Greatness of Kiddush Hashem","https://www.torahanytime.com/lectures/210509"
"R. Iris Odani Elyashiv","Parashat Lech Lecha Knowing HaShem and influencing others to walk in His Ways.","https://www.torahanytime.com/lectures/210487"
"R' Moshe Bamberger","Vilna Gaon: The Avos Established Tefillah","https://www.torahanytime.com/lectures/210489"
"R' Eytan Feiner","Rav Shimshon's Remarkable Remazim in Rashi's Peirush","https://www.torahanytime.com/lectures/210475"
"R' Ariel Mizrahi","Choose Your Friends Wisely","https://www.torahanytime.com/lectures/210469"
"R' Yitzchok Sorotzkin","The Weekly Message from the Rosh Yeshiva: Parashat Lech Lecha","https://www.torahanytime.com/lectures/210464"
"R' Yisroel Brog","Parashat Lech Lecha - Striving from the Nisyonos of Avrohom Avinu","https://www.torahanytime.com/lectures/210462"
"R' Yirmiyahu Cohen","TnT Why is it so hard to decide?","https://www.torahanytime.com/lectures/210460"
"R' Shmuel Greenberg","Parashat Lech Lecha: Avraham Likes Presents & Nachum Ish Gam Zu","https://www.torahanytime.com/lectures/210452"
"R' Daniel Kalish","Lech Lecha: Be Uncomfortable!","https://www.torahanytime.com/lectures/210453"
"R' Yaakov Rahimi","Be ready to move on!","https://www.torahanytime.com/lectures/210440"
"R' Dovid Lichtenstein","Parashat Lech Lecha - The Difference Between Avraham and Lot (Excerpt from Halacha Headlines Shiur 191, 2018)","https://www.torahanytime.com/lectures/210415"
"R' Yitzchak Oelbaum","Parashat Lech Lecha: Easy Way to Make Kiddush Hashem","https://www.torahanytime.com/lectures/210412"
"R' Pinchas Landis","Rabbis Podcast 2.0 Episode 6 – The Center Of The World","https://www.torahanytime.com/lectures/210403"
"R' Fischel Schachter","Parashat Lech Lecha: The Longest Train","https://www.torahanytime.com/lectures/210391"
"R' Avi Wiesenfeld","Tests and Challenges are What Build Us","https://www.torahanytime.com/lectures/210381"
"Kollel Ohr Shmuel","R’ Roth: וּמָצָאתָ אֶת לְבָבו נֶאֱמָן לְפָנֶיךָ! Being faithful like Avrohom avinu","https://www.torahanytime.com/lectures/210383"
"R' Eliezer Krohn","Chessed L'Avraham","https://www.torahanytime.com/lectures/210349"
"R' Mordechai Lebhar","Parashat Lech lecha: Rabbi Yaakov Abuchatzira on Why We Didn’t Have to be 400 Years in Egypt","https://www.torahanytime.com/lectures/210334"
"R' Eytan Feiner","Avraham Avinu... In Pursuit of Gifts from Pharaoh??","https://www.torahanytime.com/lectures/210331"
"R. K. Sarah Cohen","Parshat Lech Lecha: To The Land That I Will Show You","https://www.torahanytime.com/lectures/210305"
"R' Yisroel Brog","Parashat Lech Lecha - Analyzing Avrohom Avinu part 2 and Reb Yanky Meyer","https://www.torahanytime.com/lectures/210301"
"R' Yosef Greenfeld","The Nisyonos of Avraham Avinu","https://www.torahanytime.com/lectures/210300"
"R' Daniel Glatstein","Lech Lecha: Circumcising The Heart","https://www.torahanytime.com/lectures/210292"
"R' Daniel Glatstein","Parashat Lech Lecha : The First Communication of Torah - The Revolutionary Chidush of Rav Yosef Engel","https://www.torahanytime.com/lectures/210269"
"R' Ilan Halberstadt","Parashat Lech Lecha - The Palace on Fire","https://www.torahanytime.com/lectures/210259"
"R' Daniel Glatstein","ALL PARSHA - The Ben L'ashri on Parashat Lech Lecha","https://www.torahanytime.com/lectures/210243"
"R' Yehuda Mandel","World of Navardok Lech lecha 1","https://www.torahanytime.com/lectures/210200"
"R' Shlomo Farhi","Lech Lecha: The Blessing Of A Good Name","https://www.torahanytime.com/lectures/210202"
"R' Chaim Veshnefsky","Parashat Lech Lecha: Alshich Hakadosh: Who Was the Greatest of the Three Avot?","https://www.torahanytime.com/lectures/210183"
"R' Yisroel Brog","Parashat Lech Lecha - Analyzing Avrohom Avinu part 1","https://www.torahanytime.com/lectures/210163"
"R' Daniel Glatstein","ALL PARSHA- The Ramban on Parashat Lech Lecha","https://www.torahanytime.com/lectures/210164"
"R' Benzion Twerski","The Exalted purpose of Nisyonos","https://www.torahanytime.com/lectures/210156"
"R' Yonoson Roodyn","Avraham Avinu and the Mitzvah to Reach Out","https://www.torahanytime.com/lectures/210158"
"R' Daniel Glatstein","Sefer Bereishit: The Book of Creation of the Destiny & Personality of the Jewish People","https://www.torahanytime.com/lectures/210132"
"R' Issamar Ginzberg","Parashat Lech Lecha: Halfway up the Ladder; Being Besimcha Doing HaShem’s Will","https://www.torahanytime.com/lectures/210127"
"R' Yosef Greenfeld","How Do You Find a Makom Torah?","https://www.torahanytime.com/lectures/209469"
"R' Yosef Greenfeld","A Lesson In Derech Eretz From Avraham Avinu","https://www.torahanytime.com/lectures/204900"
"R' Yosef Greenfeld","Is There Still a Mitzvah to Be Melave Today?","https://www.torahanytime.com/lectures/204010"
"R' Shay Schachter","Finding and Connecting With Hashem in the Beauty of Nature","https://www.torahanytime.com/lectures/202599"
"R' Yosef Greenfeld","Bitachon/Hishtadlus","https://www.torahanytime.com/lectures/198363"
"R' Yosef Greenfeld","Looking to the Future","https://www.torahanytime.com/lectures/197575"
"R' Yosef Greenfeld","Whats the Reason They Make Hafganos?","https://www.torahanytime.com/lectures/194888"
"R' Yosef Greenfeld","Where Do We Come From?","https://www.torahanytime.com/lectures/174397"
"R' Avrohom Snyder","Parshat Lech lecha","https://www.torahanytime.com/lectures/166745"
"R' Eliezer Ginsburg","Parashat Lech Lecha","https://www.torahanytime.com/lectures/165791"
"R' Avrohom Kahan","Parashat Lech Lecha","https://www.torahanytime.com/lectures/165634"
"R' Yitzchak Breitowitz","Parashat Lech Lecha: Why did Hashem Chose Avraham?","https://www.torahanytime.com/lectures/165497"
"R' Yussie Zakutinsky","Parashat Lech Lecha - Avraham Avinu, Abayeh, Rava, and the Baal Shem Tov","https://www.torahanytime.com/lectures/165255"
"R' Yussie Zakutinsky","Parashat Lech Lecha - Finding The Name Hashem Has Given You","https://www.torahanytime.com/lectures/165253"
"R' Daniel Belsky","Parashat Lech Lecha 5782","https://www.torahanytime.com/lectures/165240"
"R' Ariel Mizrahi","Consciously Unconscious","https://www.torahanytime.com/lectures/165223"
"R' Nota Schiller ZT""L","The Good and or the Fair","https://www.torahanytime.com/lectures/165218"
"R' Ephraim Wachsman","Parashat Lech Lecha - Working On Our Middos","https://www.torahanytime.com/lectures/165188"
"R' Kalman Worch","Sefer Daas Torah-Lech Lecha-Rooting Faith","https://www.torahanytime.com/lectures/165154"
"R' Shmuel Greenberg","Parashat Lech Lecha: Did Avrohom and Sorah Create the World?","https://www.torahanytime.com/lectures/165138"
"R' Yosef Greenwald","Nefesh Hachaim 74- Mot'Sh Lech Lecha 5782","https://www.torahanytime.com/lectures/165117"
"R' Shay Tahan","Why Did Avraham Give Over His Wife For Money?","https://www.torahanytime.com/lectures/165096"
"R' Doniel Osher Kleinman","Parashat Lech Lecha: Common Tefillin Pitfalls","https://www.torahanytime.com/lectures/165084"
"R' Yosef Greenwald","Hashem's Shefah comes to us through Avraham!","https://www.torahanytime.com/lectures/165082"
"R' Avrohom Stulberger","Arayot: Not Just a Chumra! - Lech Lecha 5782","https://www.torahanytime.com/lectures/165075"
"R' Aharon Pessin","Parashat Lech Lecha: How to Deal with Tests?","https://www.torahanytime.com/lectures/165074"
"R' Elyahou Quedoshim","Parashat Lech Lecha: Kirvat Elokim","https://www.torahanytime.com/lectures/165070"
"R' Michael Mansour","Our Life Challenge of Lech Lecha","https://www.torahanytime.com/lectures/165068"
"R' Yitzchok Bistritzky","Parashat Lech Lecha - Emunah in our Hearts","https://www.torahanytime.com/lectures/165059"
"R' Daniel Glatstein","Five Electrifying Divrei Torah on Parashat Lech Lecha & How To See In Print}","https://www.torahanytime.com/lectures/165053"
"R' Shlomo Farhi","Lech Lecha: To Call In The NAME Of God","https://www.torahanytime.com/lectures/165052"
"R' Yosef Greenwald","Echad Hayah Avraham- remembering Rav Avraham Erlanger ZT'L","https://www.torahanytime.com/lectures/165046"
"R' Ari Goldwag","Lech Lecha: Through the Fire","https://www.torahanytime.com/lectures/165044"
"R' Ari Bensoussan","Nesivas Shalom- Lech Lecha- The Heart of a Test","https://www.torahanytime.com/lectures/165041"
"R' Shraga Kallus","Parashat Lech Lecha: 3 Billion Dollar Wedding Ring","https://www.torahanytime.com/lectures/165036"
"R' Duvi Bensoussan","Parashat Lech Lecha: How to get Hashem to Save you from Big Trouble","https://www.torahanytime.com/lectures/165033"
"R' Meir Simcha Sperling","Bad Places, Bad People, Prayer And Emunah, Three Vorts On The Parsha.","https://www.torahanytime.com/lectures/165030"
"R' YY Rubinstein","The Alshich on Parashat Lech Lecha","https://www.torahanytime.com/lectures/165027"
"R' Avi Bensoussan","Parashat Lech Lecha: Raise Your Flag With Pride","https://www.torahanytime.com/lectures/165022"
"R' Yehoshua Sova","Zera Shimshon on Parashat Lech Lecha","https://www.torahanytime.com/lectures/165021"
"R' Abraham Buzali","Maqam Saba for Parashat Lech Lecha-Sephardic Custom","https://www.torahanytime.com/lectures/165017"
"R' Shraga Kallus","Parashat Lech Lecha: R' Shamshon Refael Hirsh's Visa","https://www.torahanytime.com/lectures/165011"
"R' Dovid Eisenberg","Zera Shimshon Lech Lecha","https://www.torahanytime.com/lectures/165010"
"R' Zev Leff","Parashat Lech Lecha","https://www.torahanytime.com/lectures/165008"
"R' Berel Wein ZTL","Parashat Lech Lecha","https://www.torahanytime.com/lectures/165006"
"R' Shmuel Schwarz","Lech Lecha-Let's Meet the Man who Started it All","https://www.torahanytime.com/lectures/165001"
"R' Shraga Feivel Zimmerman","Total Emunah","https://www.torahanytime.com/lectures/164998"
"R' Zev Leff","Parashat Lech Lecha","https://www.torahanytime.com/lectures/164997"
"R' Yaakov Asher Sinclair","Is it better to travel hopefully than to arrive?","https://www.torahanytime.com/lectures/164985"
"R' Nissan Hakakian","Being successful by focusing on the right thing","https://www.torahanytime.com/lectures/164984"
"R' Avi Slansky","Lech-Lecha/ Lich-luch = GARBAGE!!","https://www.torahanytime.com/lectures/164942"
"R' Moshe Don Kestenbaum","Parashat Lech Lecha: Tying Laces and Embracing Birthdays","https://www.torahanytime.com/lectures/164981"
"R' Fischel Schachter","Parashat Lech Lecha: Ohr HaChaim - Phoneless but well connected","https://www.torahanytime.com/lectures/164978"
"R' Motti Neuburger","Lech Lecha Gems","https://www.torahanytime.com/lectures/164977"
"R' Daniel Kalish","Parashat Lech Lecha: Can You Adjust [A Must Listen]","https://www.torahanytime.com/lectures/164976"
"R' Zvi Zimmerman","Parashat Lech Lecha: Laughing for Good!","https://www.torahanytime.com/lectures/164975"
"R' Baruch Bodenheim","Parashat Lech Lecha: Emunah is Reality","https://www.torahanytime.com/lectures/164974"
"R' Eliezer Ginsburg","Parasha Lech Lecha","https://www.torahanytime.com/lectures/164973"
"R' Yisroel Brog","Parashat Lech Lecha - Fame for Hashem's Sake!","https://www.torahanytime.com/lectures/164972"
"R' Bentzion Shafier","The Shmuz on Parashat Lech Lecha: A Diamond With a Flaw","https://www.torahanytime.com/lectures/164968"
"R' Yosef Radner","Lech Lecha","https://www.torahanytime.com/lectures/164967"
"R' Eliyahu Maksumov","Parashat Lech Lecha - Beyond the Stars","https://www.torahanytime.com/lectures/164962"
"R' Yitzchok Sorotzkin","The Weekly Message From the Rosh Yeshiva: Parashat Lech Lecha","https://www.torahanytime.com/lectures/164953"
"R' Shlomo Cynamon","Lomdut on Lech Lecha: Were Canannites Squatters?","https://www.torahanytime.com/lectures/164957"
"R' Labish Becker","Parashat Lech Lecha 5782 - Rachmones Iz Ah Yid","https://www.torahanytime.com/lectures/164955"
"R' Motti Neuburger","The Significance of Bris Bain HaBesarim","https://www.torahanytime.com/lectures/164954"
"R' Ilan Halberstadt","Lech Lecha: Our Mission Statement - Be a Brocha","https://www.torahanytime.com/lectures/164949"
"R' Yehoshua Landau","The Battle of The 318","https://www.torahanytime.com/lectures/164948"
"R' Shlomo Landau","Practical Parsha Perspectives Lech Lecha; the challenges are where it’s really at!","https://www.torahanytime.com/lectures/164947"
"R' Yosef Palacci","Parashat Lech Lecha: Hashem Will Pay You Tremendous Reward","https://www.torahanytime.com/lectures/164941"
"R' Mordechai Kalatsky","10 Tests Of Avraham & How They Apply To My Personal Life","https://www.torahanytime.com/lectures/164934"
"R' Joey Haber","Parashat Lech Lecha: Get Up and Go","https://www.torahanytime.com/lectures/164929"
"R' Leiby Burnham","Lech Lecha - The Red Wings don't care about me?","https://www.torahanytime.com/lectures/164924"
"R' Yaakov Harari","Parashat Lech Lecha - Reach Your Potential","https://www.torahanytime.com/lectures/164908"
"R' Shraga Kallus","Parashat Lech Lecha: The Debate Ponovetz Rov VS Reform Rabbi","https://www.torahanytime.com/lectures/164904"
"R' Chaim Rosenfeld","Jewish DNA; Kindness","https://www.torahanytime.com/lectures/164903"
"R' Nosson Greenberg","Lech lecha 5782- Four Jews Walk Into The Parsha","https://www.torahanytime.com/lectures/164891"
"R' Dovid Genish","Noach & Lech Lecha - Finding The Real You","https://www.torahanytime.com/lectures/164890"
"R' Ariel Mizrahi","Incentivizing Mitzvot","https://www.torahanytime.com/lectures/164885"
"R' Michel Twerski","Parashat Lech Lecha- Thursday","https://www.torahanytime.com/lectures/164882"
"R' Michel Twerski","Parashat Lech Lecha - Wednesday","https://www.torahanytime.com/lectures/164881"
"R' YY Jacobson","Parashat Lech Lecha - When Your Child Says Nasty Things - Those Who Curse Jews and Those Who Bless Them","https://www.torahanytime.com/lectures/164873"
"R' Pesach Siegel","Parashat Lech Lecha - Mashiach in Sodom","https://www.torahanytime.com/lectures/164872"
"R' Shmuel Zucker","Lech Lecha - The Two Types of Malchus","https://www.torahanytime.com/lectures/164869"
"R' Meir Kahane","Aish Kodesh, Lech L'cha, 5702, Expanding My Relationship With Hashem","https://www.torahanytime.com/lectures/164868"
"R' Yerachmiel Milstein","Parashat Lech Lecha: It’s Time to “Grow” Away","https://www.torahanytime.com/lectures/164853"
"R' Fischel Schachter","Parashat Lech Lecha","https://www.torahanytime.com/lectures/164852"
"Mrs. Amit Yaghoubi","Parashat Lech Lecha: Establishing the True Ruler","https://www.torahanytime.com/lectures/164850"
"R' Dovid Eisenberg","Why did Avraham Avinu stop being a zealot?","https://www.torahanytime.com/lectures/164841"
"R' Uri Lati","Parashat Lech Lecha- Break Those Idols","https://www.torahanytime.com/lectures/164840"
"R' Yitzchok Aryeh Epstein","Stimulating stories about Lech Lecha","https://www.torahanytime.com/lectures/164809"
"R' Ari Bensoussan","Nesivas Yoisher- Parashat Lech Lecha- Setting Boundries","https://www.torahanytime.com/lectures/164829"
"R' Avrohom Krohn","Lech Lecha: Learning From Avraham Avinu And From The Life of Rav Avrohom Erlanger","https://www.torahanytime.com/lectures/164826"
"R' Ari Neuwirth","Strength Lies in Separation not in Acculturation","https://www.torahanytime.com/lectures/164819"
"R' Eliezer Simcha Lieff","Parashat Lech Lecha: The Right Crowd","https://www.torahanytime.com/lectures/164818"
"R' Daniel Glatstein","DOUBLE LECH LECHA","https://www.torahanytime.com/lectures/164816"
