"author","title","link"
"R' Noach Isaac Oelbaum","Parshat Lech Lecha: Power Of Emunah Through Out Jewish History Inherited From Avrohom Avinu","https://www.torahanytime.com/lectures/94151"
"R' Shalom Yona Weis","The Journey To Hashem IS The Journey To The Self!","https://www.torahanytime.com/lectures/94149"
"R' Shais Taub","Parashat Lech Lecha: How to Be Popular Without Selling Out","https://www.torahanytime.com/lectures/94148"
"R' Daniel Glatstein","Parashat Lech-Lecha: Meet Amasla'i Bas Karnebo, Mother of Avraham Avinu","https://www.torahanytime.com/lectures/94146"
"R' Eliezer Krohn","Our Avodah For Cheshvan Know Who You Are","https://www.torahanytime.com/lectures/94145"
"R' Yisroel Brog","Parashat Lech Lecha - If you Love Hashem, then you Hate Evil!","https://www.torahanytime.com/lectures/94144"
"R' Motti Neuburger","Avraham Avinu & the ""Maaseh Avos Siman L'Banim"" of the Meraglim","https://www.torahanytime.com/lectures/94143"
"R' Yechezkel Hartman","Why was Avraham Avinu Chosen?","https://www.torahanytime.com/lectures/94141"
"R' Daniel Kalish","Parshat Lech Lecha: We Are Not Wired To Be Natural","https://www.torahanytime.com/lectures/94130"
"R' Mordechai Aderet","Parashat Lech Lecha: Be Like Avraham","https://www.torahanytime.com/lectures/94105"
"R' Dovid Kaplan","Parshat Lech Lecha: Action or Reaction","https://www.torahanytime.com/lectures/94101"
"R' Nissan Hakakian","The 3 last words of advice that David Hamelech said to his son Shlomo","https://www.torahanytime.com/lectures/94099"
"R' Nachum Chaimowitz","Parshat Lech Lecha: The Holographic World of Avraham Avinu","https://www.torahanytime.com/lectures/94091"
"R' Dovid Eisenberg","Lech Lecha - Normalizing the abnormal","https://www.torahanytime.com/lectures/94088"
"R' Moshe Meir Weiss","Parashat Lech Lecha Gems 5780","https://www.torahanytime.com/lectures/94084"
"R' Chaim Veshnefsky","Parashat Lech Lecha: Why Is This Happening to ME?","https://www.torahanytime.com/lectures/94071"
"R' Gil Freiman","Parshat Lech Lecha 80 Not Just Giving But Giving Up","https://www.torahanytime.com/lectures/94069"
"R' Yisroel Brog","Parashat Lech Lecha - The DNA of Avraham Avinu is in Every Jew!","https://www.torahanytime.com/lectures/94065"
"R' Eytan Feiner","""Imri Na Achosi At"": How Could Avraham Put Sarah in Danger??","https://www.torahanytime.com/lectures/94063"
"R' Daniel Kalish","Parshat Lech Lecha: Abraham's Dream","https://www.torahanytime.com/lectures/94059"
"R' Dovid Kaplan","Parshat Lech Lecha: Spiritual Tests","https://www.torahanytime.com/lectures/94054"
"R' Yussie Zakutinsky","R. Tzadok HaCohen - Parashat Lech Lecha: The Key to Our Survival","https://www.torahanytime.com/lectures/94047"
"R' Moshe Tuvia Lieff","Parashat Lech Lecha: Dont Ever Give Up","https://www.torahanytime.com/lectures/94022"
"R' Naftali Reich","Parashat Lech Lecha: Finding the real me...!","https://www.torahanytime.com/lectures/94000"
"R' Daniel Kalish","Parshat Lech Lecha: Head in The Sky Feet on The Ground","https://www.torahanytime.com/lectures/93992"
"R' Yisroel Brog","Parashat Lech Lecha - Divesting from Anti-Torah Culture","https://www.torahanytime.com/lectures/93978"
"R' Eytan Feiner","Avraham Avinu & the Beginning of ""MATAN Torah""","https://www.torahanytime.com/lectures/93977"
"R' Daniel Glatstein","Parashat Lech Lecha: Believe It or Not","https://www.torahanytime.com/lectures/93953"
"R' Aryeh Kerzner","A Halacha for Lech Lecha: Is VISITING Eretz Yisrael A Mitzvah?","https://www.torahanytime.com/lectures/93938"
"R' Daniel Kalish","Parshat Lech Lecha: Individuals, Not Institutions","https://www.torahanytime.com/lectures/93919"
"R' Yisroel Brog","Parashat Lech Lecha - The Challanges you Want and Need to have!","https://www.torahanytime.com/lectures/93909"
"R' Motti Neuburger","Avraham Avinu's Legacy of ""Maase Avot Siman L'Banim""","https://www.torahanytime.com/lectures/93907"
"R' Benzion Twerski","Restoring the Balance","https://www.torahanytime.com/lectures/93902"
"R' Mordechai Finkelman","Parashat Lech Lecha: Simple Belief - Emuna At Its Highest Level","https://www.torahanytime.com/lectures/93881"
"R. Iris Odani Elyashiv","Parashat Lech Lecha Assimilation a Qquite Holocaust Part B","https://www.torahanytime.com/lectures/77513"
"R. Iris Odani Elyashiv","Parashat Lech Lecha Assimilation a Quite Holocaust Part A","https://www.torahanytime.com/lectures/72382"
"R' Daniel Belsky","Parashat Lech Lecha: The relationship between the Parasha and the Haftorah","https://www.torahanytime.com/lectures/69194"
"R' Leeor Dahan","Parashat Lech Lecha: Avraham's Victory, Miracle or Mentality?","https://www.torahanytime.com/lectures/69171"
"R' Benzion Twerski","Is There Truth in the World of ‘If Only’?","https://www.torahanytime.com/lectures/69120"
"R' Dovid Orlofsky","Parashat Lech Lecha: Light Unto the Nations","https://www.torahanytime.com/lectures/69090"
"R' Yosef Chaim Schwab","Gigantic Little Secrets of the Torah: Lech Lecha Part 3","https://www.torahanytime.com/lectures/69027"
"R' Daniel Glatstein","Haftorah Series Part 4- Lech Lecha: Mystical Secrets Courtesy of the Ben Ish Chai...and Sadam Hussein","https://www.torahanytime.com/lectures/69021"
"R' Moshe Tuvia Lieff","Rav Tzadok HaKohen on Parashat Lech Lecha: Its All About the Journey","https://www.torahanytime.com/lectures/69020"
"R' Doniel Osher Kleinman","Parshat Lech Lecha: When It Can Be Dangerous To Refuse","https://www.torahanytime.com/lectures/69017"
"R' Yitzchak Joshua","Parshat Lech Lecha: Ishmael's Roots and the Affliction of Hagar","https://www.torahanytime.com/lectures/69007"
"R' Nachum Scheiner","Parashat Lech Lecha: Defining Mitzvat Milah - Cutting the Orlah or Removing It?","https://www.torahanytime.com/lectures/69000"
"R' Ari Goldwag","Parashat Lech Lecha: The Land I Will Show You","https://www.torahanytime.com/lectures/68997"
"R' Ari Neuwirth","Parashat Lech Lecha: When to Lead & When to Follow","https://www.torahanytime.com/lectures/68990"
"R' Shraga Kallus","Parashat Lech Lecha - Difficulties in leaving home","https://www.torahanytime.com/lectures/68989"
"R' Yisroel Majeski","Parashat Lech Lecha: Make Yourself Great Again","https://www.torahanytime.com/lectures/68981"
"R' Yaakov Harari","Parashat Lech Lecha: The Power of Avraham Avinu Within Us","https://www.torahanytime.com/lectures/68980"
"R' Asaf Haimoff","Parashat Lech Lecha: Responding to Difficulty","https://www.torahanytime.com/lectures/68978"
"R' Nissan Hakakian","Parashat Lech Lecha: The First And Last Nisayon","https://www.torahanytime.com/lectures/68976"
"R' Shmuel Greenberg","Lech Lecha: Avraham - A Creator Starts with Looking","https://www.torahanytime.com/lectures/68973"
"R' Yechezkel Hartman","Parsha B'Iyun - Lech Lecha 78: A Postponed Bris and The Bris of Avraham Avinu","https://www.torahanytime.com/lectures/68966"
"R' Eliezer Ginsburg","Parashat Lech Lecha","https://www.torahanytime.com/lectures/68965"
"R' Baruch Bodenheim","Parashat Lech Lecha: The Greatest Present","https://www.torahanytime.com/lectures/68961"
"R' Noach Isaac Oelbaum","Lech Lecha: Fundamental Insights Into The World of Bris Milah And Learn From Avrohom Avinu The Power Of Prayer","https://www.torahanytime.com/lectures/68959"
"R' Efraim Stauber","Lech Lecha: Contrary to Popular Belief, Hashem Never Says ""NO""","https://www.torahanytime.com/lectures/68957"
"R. Dr. Yaakov Siegel","Parshat Lech Lecha: Hard Schooling Of Suffering","https://www.torahanytime.com/lectures/68956"
"R' Zvi Zimmerman","Parashat Lech Lecha: The Royal Rumble","https://www.torahanytime.com/lectures/68954"
"R' Yisroel Brog","Breaking free from your surroundings!","https://www.torahanytime.com/lectures/68950"
"R' Zecharia Wallerstein ZTL","Parashat Lech Lecha: You Must Leave Your Place In Order to Move Forward","https://www.torahanytime.com/lectures/68943"
"R' Labish Becker","Parashat Lech Lecha","https://www.torahanytime.com/lectures/68939"
"R' Chaim Eisenstein","Parashat Lech Lecha: The Pipe and The Vessel","https://www.torahanytime.com/lectures/68935"
"R' Elchonon Jacobovitz","Parashat Lech Lecha: The Dawn of Kings -Rav Moshe Shapiro ztl, expounded","https://www.torahanytime.com/lectures/68934"
"R' Shraga Kallus","Parashat Lech Lecha - Faulty foundation","https://www.torahanytime.com/lectures/68929"
"R' Yosef Kalatsky","Parashat Lech Lecha: Qualifying As The Founding Father of A Chosen People.","https://www.torahanytime.com/lectures/68923"
"R' Yitzchak Berkovits","Parashat Lech Lecha","https://www.torahanytime.com/lectures/68920"
"R' Zev Leff","Parashat Lech Lecha: The Essence of Yerushalayim","https://www.torahanytime.com/lectures/68913"
"R' Nosson Greenberg","Lech Lecha - Insights","https://www.torahanytime.com/lectures/68909"
"R' Elyakim Rosenblatt ZTL","Parashat Lech Lecha: Let Us Not Stray From Our Sacred Mission","https://www.torahanytime.com/lectures/68907"
"R' Naftali Reich","Parashta Lech Lecha: 'Star Power - Star Dust'","https://www.torahanytime.com/lectures/68887"
"R' Motti Neuburger","Parashat Lech Lecha: Avraham's Chiddush to be the First to Call Hashem "" A-D-N-Y","https://www.torahanytime.com/lectures/68885"
"R' Yosef Chaim Schwab","Gigantic Little Secrets of the Torah: Lech Lecha Part 2","https://www.torahanytime.com/lectures/68882"
"R' Moshe Tuvia Lieff","Parashat Lech Lecha: Must a Father Be a Mohel?","https://www.torahanytime.com/lectures/68879"
"R' Zecharia Wallerstein ZTL","Parashat Lech Lecha: You Take the First Step","https://www.torahanytime.com/lectures/68878"
"R' Yosef Palacci","Parashat Lech Lecha: A Must Hear To Be Great Not Average","https://www.torahanytime.com/lectures/68877"
"R' Fischel Schachter","Parashat Lech Lecha: Bounce Back","https://www.torahanytime.com/lectures/68875"
"R. K. Sarah Cohen","Parshat Lech Lecha: Can A Sin Be Kosher?","https://www.torahanytime.com/lectures/68873"
"R' Yitzchok Fingerer","Parashat Lech Lecha: The Real Truth about Avraham Avinu’sParents - Who Were they Really?","https://www.torahanytime.com/lectures/68872"
"R' Noach Light","Parashat Lech Lecha: Choices That Change You","https://www.torahanytime.com/lectures/68870"
"R' Chaim Rosenfeld","Parashat Lech Lecha: Testing 12345678910","https://www.torahanytime.com/lectures/68869"
"R' Daniel Glatstein","Parashat Lech Lecha : The First Communication of Torah - The Revolutionary Chidush of Rav Yosef Engel","https://www.torahanytime.com/lectures/68868"
"R' Gabi Fried","Parshat Lech Lecha: ""Upward Spiral""","https://www.torahanytime.com/lectures/68865"
"R' Eliezer Simcha Lieff","Parshat Lech Lecha: Avrohom Avinu Korbanot and Emunah","https://www.torahanytime.com/lectures/68864"
"R' Kalman Worch","Parashat Lech Lecha: Relevant Revelations - The Lies of War","https://www.torahanytime.com/lectures/68863"
"R' Shlomo Cynamon","Lomdut on Parashat Lech Lecha / Constantly Renewing Your Marriage","https://www.torahanytime.com/lectures/68861"
"R' Yisroel Brog","Realizing our power to overcome Nature!","https://www.torahanytime.com/lectures/68858"
"R' Ilan Halberstadt","Understanding Avraham Avinu through the events of Lech Lecha","https://www.torahanytime.com/lectures/68856"
"R' Jeremy Golker","The Weekly Parsha Slot: Lech Lecha","https://www.torahanytime.com/lectures/68853"
"R' Avi Wiesenfeld","Parashat Lech Lecha - Challenge Helps You Grow!","https://www.torahanytime.com/lectures/68833"
"R' Eytan Feiner","Parashat Lech Lecha: The Connection Between Shoelaces & Tefillin","https://www.torahanytime.com/lectures/68828"
"R' Shmuel Greenberg","Lech Lecha: Time of Danger and Avraham is Thinking of Presents!! Understanding the Story of Nachum Ish Gam Zu","https://www.torahanytime.com/lectures/68822"
"R' Shmuel Greenberg","Lech Lecha: Goy Gadol = Avraham, Avorechicha = Yitzchak, Shemecha = Yaakov Why & How","https://www.torahanytime.com/lectures/68812"
"R' Mordechai Aderet","Parashat Lech Lecha: Who Named Jerusalem","https://www.torahanytime.com/lectures/68811"
"R' Moshe Meir Weiss","Lech Lecha Gems 5779","https://www.torahanytime.com/lectures/68804"
"R' Mashiach Kelaty","Parashat Lech Lecha: The Impossible","https://www.torahanytime.com/lectures/68803"
"R' Mashiach Kelaty","Parashat Lech Lecha: Loyalty","https://www.torahanytime.com/lectures/68802"
"R' Yitzchak Botton","Avraham's Journey in Today's World - Mystical Insights on the Parsha","https://www.torahanytime.com/lectures/68788"
"R' Yechezkel Hartman","Avraham Avinu and The Profound Meaning of Bris Milah","https://www.torahanytime.com/lectures/68797"
"R' Gil Freiman","Parshat Lech Lecha - Don’t waste your time he is not interested","https://www.torahanytime.com/lectures/68796"
"R' Yisroel Brog","What is the true source of your success?!?","https://www.torahanytime.com/lectures/68793"
"R' Elyakim Rosenblatt ZTL","Chassidic Gems Parashat Lech Lecha","https://www.torahanytime.com/lectures/68782"
"R' Moshe Tuvia Lieff","Parashat Lech Lecha: Go Out and Define Yourself","https://www.torahanytime.com/lectures/68760"
"R' Yosef Chaim Schwab","Gigantic Little Secrets of the Torah: Lech Lecha Part 1","https://www.torahanytime.com/lectures/68757"
"R' Eytan Feiner","Parashat Lech Lecha: The Obligation to See One's Kallah Before Marriage","https://www.torahanytime.com/lectures/68756"
"R' Mashiach Kelaty","Parashat Lech Lecha: Move Out, Move On, Move Up (recorded at Beis Hamedrash Woodland Hills, Los Angeles)","https://www.torahanytime.com/lectures/68747"
"R' Chaim Dahan ZT""L","Divrie Torah Lech Lecha","https://www.torahanytime.com/lectures/68737"
"R' Yisroel Brog","Are You Really Living?","https://www.torahanytime.com/lectures/68726"
"R' Shraga Kallus","Parashat Lech Lecha - Use what you have for the good!","https://www.torahanytime.com/lectures/68719"
"R' Dovid Rosman","Parashat Lech Lecha","https://www.torahanytime.com/lectures/68705"
"R' Daniel Glatstein","Parashat Lech-Lecha : ""Sweet Revenge"" -Revolutionizing the War of the 4 Kings and the 5 Kings","https://www.torahanytime.com/lectures/68674"
"R' Motti Neuburger","Explaining the Nisayon of Lech Lecha","https://www.torahanytime.com/lectures/68643"
"R' Yisroel Brog","Parashat Lech Lecha: Are You Really Following In The Ways of Avraham Avinu??","https://www.torahanytime.com/lectures/68638"
"R' Moshe Meir Weiss","Lech Lecha Thoughts 5779","https://www.torahanytime.com/lectures/68637"
"R' Yitzchak Botton","Lech-Lecha: The Untold Story of Avraham - Based on Midrash & The Arizal","https://www.torahanytime.com/lectures/68627"
"R' Mordechai Finkelman","Parashat Lech Lecha: The Most Important Gene","https://www.torahanytime.com/lectures/68612"
"R' Leiby Burnham","Sefer Bereishit In-Depth, Parashat Lech Lecha: Part 4 - The First Jewish Road Trip","https://www.torahanytime.com/lectures/51120"
"R' Mordechai Aderet","Parshat Lech Lecha: 10 Tests","https://www.torahanytime.com/lectures/50483"
"R' Asaf Haimoff","Avraham Avinu's Search for Truth","https://www.torahanytime.com/lectures/50217"
"R' Benzion Twerski","Shabbos Preserves the Jew in Galus","https://www.torahanytime.com/lectures/49992"
"R' Eytan Feiner","Did Avraham Put Sarah In Danger Saying ""she Is My Sister?”","https://www.torahanytime.com/lectures/49973"
"R' Asher Weiss","Parashat lech Lecha: Get Tzedek Vs. Ger Toshav","https://www.torahanytime.com/lectures/49963"
"R' Daniel Glatstein","Journey to London: The Ascendancy of the Jewish People Over Yishmael Through the Akeida","https://www.torahanytime.com/lectures/49917"
"R' Yosef Greenwald","Parashat Lech Lecha: Central Heating our Chinuch","https://www.torahanytime.com/lectures/49909"
"R' Daniel Levy","Applying the 10 Tests of Avraham Avinu to Our Daily Lives.","https://www.torahanytime.com/lectures/49906"
"R' Mordechai Finkelman","Parashat Lech Lecha: Thirst for Growth","https://www.torahanytime.com/lectures/49889"
"R' Yisroel Brog","Hashem's Grand Introduction To The World","https://www.torahanytime.com/lectures/49887"
"R' Ari Goldwag","Parashat Lech Lecha: Kingdom of Kindness","https://www.torahanytime.com/lectures/49877"
"R' Eytan Feiner","Parashat Lech Lecha: Did Avraham Keep All Mitzvos? As A Yisroel Or Ben Noach?","https://www.torahanytime.com/lectures/49875"
"R' Daniel Glatstein","Journey to London: Lech Lecha - Revolutionizing The War Between the Four Kings and The Five Kings","https://www.torahanytime.com/lectures/49857"
"R' Daniel Glatstein","Journey to Manchester: Shabbat - The Unconditional Love Between H-shem and Klal Yisroel","https://www.torahanytime.com/lectures/49854"
"R' Daniel Glatstein","Journey to Manchester: Parashat Lech Lecha - Never Despair - How To Overcome Despondency","https://www.torahanytime.com/lectures/49852"
"R' Yussie Zakutinsky","Parashat Lech Lecha: Saving Lot and the Taste of Shabbat","https://www.torahanytime.com/lectures/49849"
"R' Naftali Reich","Parashat Lech Lecha: Money Talk","https://www.torahanytime.com/lectures/49841"
"R' Labish Becker","Parashat Lech Lecha","https://www.torahanytime.com/lectures/49839"
"R' Nissan Hakakian","Parashat Lech Lecha: Never Give Up Hope","https://www.torahanytime.com/lectures/49838"
"R' Asaf Haimoff","Parashat Lech Lecha: Dwelling in Galut.","https://www.torahanytime.com/lectures/49834"
"R' Fischel Schachter","Parashat Lech Lecha : Ohr Hachaim - To See The Land Like Never Before","https://www.torahanytime.com/lectures/49833"
"R' Asaf Haimoff","Parashat Lech Lecha: Abraham Abinu Was Also Human.","https://www.torahanytime.com/lectures/49832"
"R' Eliezer Ginsburg","Parashat Lech Lecha","https://www.torahanytime.com/lectures/49830"
"R' Zvi Zimmerman","Parashat Lech Lecha: The Prequel","https://www.torahanytime.com/lectures/49829"
"R' Shlomo Cynamon","Lomdut on Parashat Lech Lecha","https://www.torahanytime.com/lectures/49828"
"R' Baruch Bodenheim","Parashat Lech Lecha: Kedushat HaBrit","https://www.torahanytime.com/lectures/49826"
"Mrs. Esther Wein","Parashat Lech Lecha: A Glimpse at Avraham's Spiritual Journey","https://www.torahanytime.com/lectures/49811"
"R' Kalman Worch","Parashat Lech Lecha: Fallen Refugees","https://www.torahanytime.com/lectures/49805"
"R' Nosson Greenberg","Lech Lecha - Divrei Torah","https://www.torahanytime.com/lectures/49804"
"R' Avi Davidowitz","Parashat Lech Lecha:m Why So Many Challenges?","https://www.torahanytime.com/lectures/49800"
"R' Elyakim Rosenblatt ZTL","Parashat Lech Lecha: Let Us Not Stray From Our Sacred Mission","https://www.torahanytime.com/lectures/49797"
"R' Ari Neuwirth","Parashat Lech Lecha: Change of Sacrifice","https://www.torahanytime.com/lectures/49791"
"R' Chaim Rosenfeld","Parashat Lech Lecha: Are People Impressed with you?","https://www.torahanytime.com/lectures/49780"
"R' Shlomo Cynamon","Lomdut on Parashat Lech Lecha - Bris Milah","https://www.torahanytime.com/lectures/49778"
"R' Yonoson Roodyn","The Hidden Message of the Final Letters - Avraham's Secret Code","https://www.torahanytime.com/lectures/49775"
"R' Zecharia Wallerstein ZTL","Parashat Lech Lecha: Drawn to The Source.","https://www.torahanytime.com/lectures/49774"
"R' Noach Light","Parashat Lech Lecha: The Discovery","https://www.torahanytime.com/lectures/49769"
"R' Yosef Palacci","Parashat Lech Lecha: Emunah & Bitachon","https://www.torahanytime.com/lectures/49768"
"R' Motti Neuburger","Parashat lech Lecha: Ur Kasdim Is Not In Torah","https://www.torahanytime.com/lectures/49765"
"R' Fischel Schachter","Parashat Lech Lecha: Yes Parking","https://www.torahanytime.com/lectures/49764"
"R' Eliezer Simcha Lieff","Parashat Lech Lecha: The Emunah of Avraham Avinu","https://www.torahanytime.com/lectures/49762"
"R' Yechezkel Hartman","Parashat Lech Lecha - The War of the Four Kings","https://www.torahanytime.com/lectures/49761"
"R' Yosef Chaim Schwab","Parashat Lech Lecha: Part 2 - ""The Ramban About Avraham's Big Sin is a Forgery""!","https://www.torahanytime.com/lectures/49751"
"R' Naftali Reich","Parashat Lech Lecha: Sustaining the Inspiration","https://www.torahanytime.com/lectures/49741"
"R' Moshe Tuvia Lieff","Parashat Lech Lecha: Love Them, Only Then Uplift Them","https://www.torahanytime.com/lectures/49739"
"R' Naftali Reich","Parashat Lech Lecha: Zaidy Avraham... Thank You!","https://www.torahanytime.com/lectures/49731"
"R' Yonoson Roodyn","Talking to Teens about Avraham Avinu's Great Discovery","https://www.torahanytime.com/lectures/49725"
"R' Avi Wiesenfeld","Lech Lecha - Withstanding the Tests","https://www.torahanytime.com/lectures/49716"
"R' Moshe Meir Weiss","Parashat Lech Lecha Gems 5778","https://www.torahanytime.com/lectures/49703"
"R' Gil Freiman","Parshat Lech Lecha -- Turn BAD into a BLESSING","https://www.torahanytime.com/lectures/49702"
"R' Fischel Schachter","Parashat Lech Lecha: Empty the Fridge","https://www.torahanytime.com/lectures/49696"
"R' Eytan Feiner","Avraham To Sarah ""Now I Know You Are Beautiful""","https://www.torahanytime.com/lectures/49693"
"R' Shmuel Greenberg","Parashat Lech Lecha: Avraham, Sarah, and Nachum Ish Gamzu","https://www.torahanytime.com/lectures/49673"
"R' Yosef Chaim Schwab","Parashat Lech Lecha: Part 1 - Avraham Saved the Spiritual World, Noach the Physical","https://www.torahanytime.com/lectures/49664"
"R' Moshe Tuvia Lieff","Parashat Lech Lecha: Brit Milah - Sign of the King","https://www.torahanytime.com/lectures/49662"
"R' Eytan Feiner","Nisayon Kivshan Aish Not in Torah/Adam=Avraham-Dovid- Moshe","https://www.torahanytime.com/lectures/49637"
"R' Daniel Glatstein","Parashat Lech Lecha: Dont Despair! - How to Overcome Despondency","https://www.torahanytime.com/lectures/49610"
"R' Eytan Feiner","Avraham Avinu, The Eysan Azrachi - The First Eysan","https://www.torahanytime.com/lectures/49559"
"R. K. Sarah Cohen","Parshat Lech Lecha: My Life's Journey Is Beneficial","https://www.torahanytime.com/lectures/49558"
"R' Mordechai Finkelman","Parashat Lech Lecha: Students of Avraham Avinu","https://www.torahanytime.com/lectures/49554"
"R' Eliezer Ginsburg","Parashat lech Lecha","https://www.torahanytime.com/lectures/38093"
"R' Gideon Shloush","Parshat Lech Lecha - Part 2","https://www.torahanytime.com/lectures/37300"
"R' Gideon Shloush","Parshat Lech Lecha - Part 1","https://www.torahanytime.com/lectures/37288"
"R' Elyakim Rosenblatt ZTL","Chassidic Gems on Parashat Lech Lecha","https://www.torahanytime.com/lectures/35492"
"R' Yosef Chaim Schwab","Parashat Lech Lecha: Part 3 - The 100 Year Old Super Host","https://www.torahanytime.com/lectures/35129"
"R' Benzion Twerski","The Palace is Burning. Is Anybody Home?","https://www.torahanytime.com/lectures/35094"
"R' Daniel Glatstein","Parashat Lech Lecha: Sweet Revenge - Revolutionizing the War Between the 4 Kings and 5 Kings","https://www.torahanytime.com/lectures/35049"
"R' Daniel Glatstein","Parashat Lech Lecha: The Disputation at Barcelona- The Epic Debate of the Ramban and Pablo Christiani Part 2","https://www.torahanytime.com/lectures/35048"
"R' Yisroel Brog","The difficult test of Greed","https://www.torahanytime.com/lectures/35046"
"R' Moshe Tuvia Lieff","Pav Tzadok HaKohen on Parashat Lech Lecha: Ahavat Hashem Through Living Life","https://www.torahanytime.com/lectures/35043"
"R' Mordechai Finkelman","Parashat Lech Lecha: ""U'leyishrei Lev Simcha"" - Joy is the Result of Uprightness","https://www.torahanytime.com/lectures/35041"
"R' Shimshon Silkin","Parashat Lech Lecha","https://www.torahanytime.com/lectures/35026"
"R' Shlomo Cynamon","Lomdut on Parashat Lech Lecha","https://www.torahanytime.com/lectures/35024"
"R' Nissan Hakakian","Parashat Lech Lecha: Over the Limit","https://www.torahanytime.com/lectures/35022"
"R' Eliezer Simcha Lieff","Parashat Lech Lecha: Connecting to Hashem Through Prayer","https://www.torahanytime.com/lectures/35021"
"R' Fischel Schachter","Parashat Lech Lecha: Ohr Hachaim - The Value of Life","https://www.torahanytime.com/lectures/35020"
"R' Yussie Zakutinsky","Parashat Lech Lecha: Connecting the End With the Beginning","https://www.torahanytime.com/lectures/35019"
"R' Avraham Gaon","Spiritual Growth Through Parashat Lech Lecha","https://www.torahanytime.com/lectures/35017"
"R' Yisroel Jungreis","Parshat Lech Lecha: Introducing Our Father Abraham and Our Mother Sarah","https://www.torahanytime.com/lectures/35004"
"R' Chaim Eisenstein","Parashat Lech Lecha: Sefer Bereishit - Science and Humility","https://www.torahanytime.com/lectures/34999"
"R' Nosson Greenberg","Lech Lecha Divrei Torah","https://www.torahanytime.com/lectures/34993"
"R' Avi Wiesenfeld","Parashat Lech Lecha - Small Steps to Success","https://www.torahanytime.com/lectures/34979"
"R' Ari Goldwag","Parashat Lech Lecha: Fame and Fortune","https://www.torahanytime.com/lectures/34977"
"R' Michel Twerski","Weekly Medrash - The Currency of Our Lives","https://www.torahanytime.com/lectures/34976"
"R' Ephraim Lever","Parashat Lech Lecha: Moving Forward","https://www.torahanytime.com/lectures/34973"
"R' Fischel Schachter","Parashat Lech lecha: Twinkle Twinkle Big Star","https://www.torahanytime.com/lectures/34972"
"R' Ari Neuwirth","Parashat Lech Lecha: Grit - It Is Our DNA","https://www.torahanytime.com/lectures/34970"
"R' Daniel Glatstein","Parashat Lech Lecha: Disputation at Barcelona -The Epic Debate of the Ramban and Pablo Christiani","https://www.torahanytime.com/lectures/34969"
"R' Chaim Rosenfeld","Parashat Lech Lecha: President Trump","https://www.torahanytime.com/lectures/34968"
"R' Yonoson Roodyn","Why does the Chumash ignore the epic story of how Avraham discovered Hashem?","https://www.torahanytime.com/lectures/34955"
"R' Daniel Travis","Two Famous people: Avraham Avinu & Donald Trump","https://www.torahanytime.com/lectures/34954"
"R' Naftali Reich","Parashat Lech Lecha: Trumping Trumps Win","https://www.torahanytime.com/lectures/34946"
"R' Mordechai Sitorsky","Parashat Lech Lecha: Lech Lecha and MarCheshvan","https://www.torahanytime.com/lectures/34929"
"R' Yechezkel Hartman","Parashat Lech Lecha: Avraham Avinu - Pillar of Chesed","https://www.torahanytime.com/lectures/34926"
"R' Mordechai Aderet","Parashat Lech Lecha: Importance of Our Brit Milah","https://www.torahanytime.com/lectures/34920"
