"author","title","link"
"R' Yehoshua Sova","Ha'azinu #4 5786","https://www.torahanytime.com/lectures/397785"
"R' Yehoshua Sova","Ha'azinu #2 5786","https://www.torahanytime.com/lectures/397526"
"R' Yehoshua Sova","Ha'azinu #3 5786","https://www.torahanytime.com/lectures/397523"
"R' Eliezer Simcha Lieff","Parashat Ha'azinu :The Power Of Klal Yisroel","https://www.torahanytime.com/lectures/397622"
"R' Dovid Eisenberg","Speak to be heard: Crafting messages that hit home","https://www.torahanytime.com/lectures/397471"
"R' Gabi Fried","All Roads Lead To... HIM!!!","https://www.torahanytime.com/lectures/397445"
"R' Moshe Tuvia Lieff","Parashat Ha'azinu - The Right Touch of Rain","https://www.torahanytime.com/lectures/397354"
"R' Hillel Eisenberg","Shocked Scientists Discover What Jews Knew Forever- The Parshah On Fire- Haazinu","https://www.torahanytime.com/lectures/397374"
"R' Eytan Feiner","Seasonings""- Yes; but Gematrios are Not ""Shas U'Poskim","https://www.torahanytime.com/lectures/397376"
"R' Zvi Zimmerman","Parashat Ha'azinu: Moshe Rabbeinu Can't Go In","https://www.torahanytime.com/lectures/397361"
"R' Moshe Chaim Biron","Ha'azinu - The National Anthem","https://www.torahanytime.com/lectures/397228"
"R' Shaul Aryeh Rosenberg","Chumash And Rashi Explained: Parshas Haazinu Part 7","https://www.torahanytime.com/lectures/386612"
"R' Yehoshua Sova","Ha'azinu #1 5786","https://www.torahanytime.com/lectures/396989"
"R' Shaul Aryeh Rosenberg","Chumash And Rashi Explained: Parshas Haazinu Part 6","https://www.torahanytime.com/lectures/386611"
"R' Shaul Aryeh Rosenberg","Chumash And Rashi Explained: Parshas Haazinu Part 5","https://www.torahanytime.com/lectures/386610"
"R' Shaul Aryeh Rosenberg","Chumash And Rashi Explained: Parshas Haazinu Part 4","https://www.torahanytime.com/lectures/386609"
"R' Elazar Meisels","Sichos Mussar on the Parshah: The Incredible Power of Tefillah","https://www.torahanytime.com/lectures/396978"
"R' Mordechai Finkelman","Parshas Ha'azinu: Preparing for a Brilliantly Radiant Shabbos","https://www.torahanytime.com/lectures/396923"
"R' Elazar Meisels","Seforno Gems: Ouch - Are We Really So Detestable?","https://www.torahanytime.com/lectures/396927"
"R' Shaul Aryeh Rosenberg","Chumash And Rashi Explained: Parshas Haazinu Part 3","https://www.torahanytime.com/lectures/386608"
"R' Shaul Aryeh Rosenberg","Chumash And Rashi Explained: Parshas Haazinu Part 2","https://www.torahanytime.com/lectures/386606"
"R' Shaul Aryeh Rosenberg","Chumash And Rashi Explained: Parshas Haazinu Part 1","https://www.torahanytime.com/lectures/386605"
"R' Yochanan Cohen","P'Haazinu- Chumish Shiur","https://www.torahanytime.com/lectures/396590"
"R' Eliezer Rottenberg","Sfas Emes Parshas Haazinu","https://www.torahanytime.com/lectures/352623"
"R' Mordechai Aderet","Parashat Ha'azinu 2024 (Rosh HaShana 5785 - The Power of Two Ways Humbleness)","https://www.torahanytime.com/lectures/326749"
"R' Daniel Belsky","Parashat Haazinu 5785, Shabbat Shuvah: Shirat HaLeviim","https://www.torahanytime.com/lectures/326425"
"R' Berel Wein ZTL","Parashat Ha'azinu: Eras of Two Thousand Year Cycles","https://www.torahanytime.com/lectures/325727"
"R' Shmuel Schwarz","Alshich - Ha'zinu - Understanding the way Hashem runs the world","https://www.torahanytime.com/lectures/325711"
"R' Yosef Greenwald","5784 Shabbos Shuva Haazinu-From the Sweetness of the Tapuach B'Dvash, to the Sweetness of the Ultimate Nekamah of HKB''H","https://www.torahanytime.com/lectures/325621"
"R' Dovid Eisenberg","3 Messages for Rosh Hashana from our Parasha","https://www.torahanytime.com/lectures/325522"
"R' Yisroel Apelbaum","Why the bent שופר?","https://www.torahanytime.com/lectures/325499"
"R' Meir Kahane","Aish Kodesh- Shabbos Shuva, 5702, Why Is It So Hard To Daven? (2021/22 Series- Enhanced III)","https://www.torahanytime.com/lectures/325488"
"R' Yehuda Mandel","World of Navardok Ha'azinu 2-5784","https://www.torahanytime.com/lectures/325443"
"R' Eytan Feiner","Two Shabbasos- Which Ones?-& then an Immediate Geula!","https://www.torahanytime.com/lectures/325419"
"R' Moshe Tuvia Lieff","Parashat Ha'azinu / Shabbat Shuvah: Don't Fool Yourself!","https://www.torahanytime.com/lectures/325410"
"R' Shlomo Farhi","Haazinu - Amen","https://www.torahanytime.com/lectures/325328"
"R' Eytan Feiner","Emulating Hashem's Ways as a ""Tzadik V'Yashar""","https://www.torahanytime.com/lectures/325308"
"R' Dovid Genish","Secret to Israel's Survival","https://www.torahanytime.com/lectures/325077"
"R' Yisroel Brog","Parshat Ha'azinu - Getting Rachamim For yom hadin: Ahavas yisroel","https://www.torahanytime.com/lectures/325127"
"R' Meir Simcha Sperling","Parshas Ha'azinu - We Are About To Crown Hashem King, Here Is Something To Think About","https://www.torahanytime.com/lectures/325050"
"R' Nosson Nussbaum","Parshas: Haazinu","https://www.torahanytime.com/lectures/324574"
"R' Dovid Kaplan","Rain Main - Ha’azinu","https://www.torahanytime.com/lectures/324941"
"R' Yisroel Apelbaum","What should we think about by תקיעת שופר?","https://www.torahanytime.com/lectures/324928"
"R' Yehoshua Balkany","Torah Insights Rosh Hashana - Ha'azinu","https://www.torahanytime.com/lectures/324920"
"R' Yehuda Mandel","World of Navardok Ha'azinu 1-5784","https://www.torahanytime.com/lectures/324888"
"R' Eytan Feiner","Heading Towards ""Hashamayim""with the Mitzvah of Milah","https://www.torahanytime.com/lectures/324876"
"R' Yisroel Brog","Parshat Ha'azinu - Realizing how much kindness yissurim comes with","https://www.torahanytime.com/lectures/324875"
"R' Elazar Meisels","Seforno Gems: When Perfection Is a Good Thing","https://www.torahanytime.com/lectures/324700"
"R' Sholom Ahron Ehrenfeld","6 Million And Some Books","https://www.torahanytime.com/lectures/315907"
"R' Sholom Ahron Ehrenfeld","The Miracle Of Hitler The Reality Of The USA בינו שנות דור ודור","https://www.torahanytime.com/lectures/315409"
"R' Sholom Ahron Ehrenfeld","Practical Judaism 33 Are Our Children convinced?","https://www.torahanytime.com/lectures/305664"
"R' Reuven Feinstein","Parashat Ha'azinu 5783","https://www.torahanytime.com/lectures/258391"
"R' Avrohom Stulberger","Kiddush Hashem - Ha'azinu/Yom Kippur 5784","https://www.torahanytime.com/lectures/257363"
"R' Yosef Greenwald","Shabbos Ha'azinu- The Shabbos of L'Asid Lavo","https://www.torahanytime.com/lectures/257364"
"R' Yosef Radner","Parshas Ha'azinu - Shabbas Shuvah","https://www.torahanytime.com/lectures/257345"
"R' Shlomo Landau","Perfect! Practical Parsha Perspectives; Haazinu","https://www.torahanytime.com/lectures/257343"
"R' Yosef Shimon Bleier","Parshas Haazinu Shvii With Rashi","https://www.torahanytime.com/lectures/257334"
"R' Noach Isaac Oelbaum","Parshat Ha'azinu Time To Fulfill Your Potential","https://www.torahanytime.com/lectures/257329"
"R' Abraham Buzali","Parashat Ha'azinu: Unbelievable Story about Rav Chaim Ozer!!","https://www.torahanytime.com/lectures/257320"
"R' Daniel Belsky","Parashat Ha'azinu - Shuvah 5784: The Light in The Dark (Kinah 44).","https://www.torahanytime.com/lectures/257301"
"R' Doniel Osher Kleinman","Parshas Ha'azinu: Making Teshuva Real","https://www.torahanytime.com/lectures/257281"
"R' Berel Wein ZTL","Parashat Ha'azinu: Heaven & Earth","https://www.torahanytime.com/lectures/257257"
"R' Ari Goldwag","Haazinu-Yom Kippur: Lend Your Ear","https://www.torahanytime.com/lectures/257237"
"R' Eliyahu Maksumov","Parashat Ha'azinu - The Power of Tzibbur","https://www.torahanytime.com/lectures/257236"
"R' Moshe Don Kestenbaum","We Owe It To Hashem","https://www.torahanytime.com/lectures/257231"
"R' Fischel Schachter","Parshas Ha'azinu: Ohr HaChaim - Answer is in My Mailbox","https://www.torahanytime.com/lectures/257215"
"R' Yehuda Mandel","World of Navardok Hazeinu 2-5784","https://www.torahanytime.com/lectures/257195"
"R' Shlomo Cynamon","Lomdot on Ha'azinu: Birchat HaTorah before Lulav?","https://www.torahanytime.com/lectures/257164"
"R' Ari Bensoussan","Medrash Hashavuah- Parshat Ha'azinu- 4- The Mouth Heart and Ears of Heaven","https://www.torahanytime.com/lectures/257151"
"R' Ari Bensoussan","Medrash Hashavuah- Parshat Ha'azinu-3- Bending Nature","https://www.torahanytime.com/lectures/257141"
"R' Meir Kahane","Aish Kodesh, Shabbos Shuva, 5702, Why Is It So Hard To Daven (2021/22 Series- Enhanced II)","https://www.torahanytime.com/lectures/257133"
"R' Moshe Meir Weiss","For the Shabbos Table Haazinu 5784","https://www.torahanytime.com/lectures/257130"
"R' Meir Simcha Sperling","Suffering Is So Hard - What Can I Do?","https://www.torahanytime.com/lectures/257080"
"R' Eliezer Simcha Lieff","Parashat Haazinu: The Gentle Way and Pointing In The Right Direction","https://www.torahanytime.com/lectures/257068"
"R' Shraga Kallus","Parshas Ha'azinu: Heiliger Bashefer","https://www.torahanytime.com/lectures/257066"
"R' Dovid Eisenberg","You can only speak if you are relevant to your audience","https://www.torahanytime.com/lectures/257009"
"R' Elazar Meisels","The Parshah You Never Knew: The Amazing Secret of the Two Klal Yisroel's","https://www.torahanytime.com/lectures/256977"
"R' Ariel Mizrahi","It’s My Time to Shine","https://www.torahanytime.com/lectures/256947"
"R' Moshe Tuvia Lieff","Parashat Ha'azinu: There's a Method to Our Madness","https://www.torahanytime.com/lectures/256962"
"R' Yosef Shimon Bleier","Parshas Haazinu Revii Till Shvii With Rashi","https://www.torahanytime.com/lectures/256936"
"R' Yitzchok Aryeh Epstein","Parshat Ha'azinu like you have never heard before","https://www.torahanytime.com/lectures/256921"
"R' Gabi Fried","You Are a Natural!!!","https://www.torahanytime.com/lectures/256901"
"R' Yosef Shimon Bleier","Parshas Haazinu Rishon Till Revii With Rashi","https://www.torahanytime.com/lectures/256744"
"R' Ari Bensoussan","Medrash Hashavuah- Parshat Ha'azinu- 2- Distance From Torah Ruins Our Tefillah","https://www.torahanytime.com/lectures/256719"
"R' Ari Bensoussan","Madrash Hashanah- Parshat Ha'azinu- 1- Bring The Heat ONLY On Shabbat Shuvah (Good Opener For Your Drashah!)","https://www.torahanytime.com/lectures/256528"
"R' Zvi Zimmerman","Parashat Ha'azinu: An Eagle and its Babies","https://www.torahanytime.com/lectures/256265"
"R' Yosef Palacci","Parashat Ha’azinu- Valuable Lessons Before Rosh Hashana","https://www.torahanytime.com/lectures/256218"
"R' Motti Sweet","Eat Like Chazal - The Mekoros","https://www.torahanytime.com/lectures/255902"
"R' Berel Wein ZTL","Parashat Haazinu: Moshe's Song","https://www.torahanytime.com/lectures/255460"
"R' Moshe Meir Weiss","For the Shabbos table Parashat Ha'azinu 5783","https://www.torahanytime.com/lectures/208191"
"R' Yosef Greenwald","Ha'azinu-The Parsha for Thinking Big Post Y'K","https://www.torahanytime.com/lectures/208177"
"R' Shlomo Farhi","Ha'azinu: 101K","https://www.torahanytime.com/lectures/208152"
"R' Daniel Travis","Parashat Ha'azinu - The Timeless Song of Jewish History","https://www.torahanytime.com/lectures/208151"
"R' Doniel Osher Kleinman","Parshat Ha'azinu - Pop Up Sukkas & Inflatable Sukkas","https://www.torahanytime.com/lectures/208140"
"R' Daniel Belsky","Parashat Ha'azinu 5783: The Sound of Eternity (Tehillim 71)","https://www.torahanytime.com/lectures/208128"
"R' Ari Goldwag","Ha'azinu: Hearing and Being Heard","https://www.torahanytime.com/lectures/208127"
"R' Chaim Eisenstein","Nesivos Shalom on Parshat Ha'azinu","https://www.torahanytime.com/lectures/208126"
"R' Berel Wein ZTL","Parashat Ha'azinu: Parenthood","https://www.torahanytime.com/lectures/208116"
"R' Yitzchok Aryeh Epstein","Stimulating stories on Hazeinu","https://www.torahanytime.com/lectures/208112"
"R' Shraga Kallus","Parshat Ha'azinu: You Chose It Bros.","https://www.torahanytime.com/lectures/208106"
"R' Eliezer Simcha Lieff","Parashat Ha'azinu: Eagles Wings and The Sukkah","https://www.torahanytime.com/lectures/208105"
"R' Daniel Glatstein","The Vilna Gaon Reveals the Spiritual and Historical Energy of Ha'azinu","https://www.torahanytime.com/lectures/208101"
"R' Fischel Schachter","Parashat Ha'azinu: Ohr HaChaim - High Gates Open Doors","https://www.torahanytime.com/lectures/208097"
"R' Shlomo Besser","Shirat Ha'azinu: Teshuva Meahava","https://www.torahanytime.com/lectures/208095"
"R' Labish Becker","Ha’azinu 5783 - “Every Pasuk a Treasure” (200th Anniversary Shiur on TorahAnytime)","https://www.torahanytime.com/lectures/208092"
"R' Zvi Zimmerman","Parashat Ha'azinu: Blame Yourself, not the Torah!","https://www.torahanytime.com/lectures/208091"
"R' Eytan Feiner","The ""Musical"" Bookends of Yom Kippur","https://www.torahanytime.com/lectures/208087"
"R' Zev Leff","Parshat Ha'azinu","https://www.torahanytime.com/lectures/208061"
"R' Meir Simcha Sperling","The Real Way To Enjoy Life ( The Story Of The Man Who Lost All His Money)","https://www.torahanytime.com/lectures/208040"
"R' Zev Leff","Parshat Ha'azinu: The Judge that is Just","https://www.torahanytime.com/lectures/208000"
"R' Moshe Tuvia Lieff","Parashat Ha'azinu: Don't Forget Hashem","https://www.torahanytime.com/lectures/207954"
"R' Eytan Feiner","A Shabbos Shuva Drasha to ""Heaven"" & ""Earth""","https://www.torahanytime.com/lectures/207658"
"R' Elazar Meisels","Harav Chaim Kanievsky zt""l on Parashat Ha'azinu","https://www.torahanytime.com/lectures/207619"
"R' Yaakov Yosef Reinman","The Pursuit of Happiness","https://www.torahanytime.com/lectures/207517"
"R' YY Rubinstein","The Alshich on Parashat Ha'azinu","https://www.torahanytime.com/lectures/163052"
"R' Meir Simcha Sperling","The Power Of Diversity","https://www.torahanytime.com/lectures/162951"
"R' Yosef Radner","Parashat Ha'azinu","https://www.torahanytime.com/lectures/162922"
"R' Daniel Glatstein","Five Electrifying Divrei Torah on Parashat Ha'azinu{& How To See In Print}","https://www.torahanytime.com/lectures/162916"
"R' Zev Leff","Parashat Ha'azinu","https://www.torahanytime.com/lectures/162882"
"R' Shraga Kallus","The Man Who Smacked Napoleon","https://www.torahanytime.com/lectures/162878"
"R' Ari Goldwag","Ha'azinu-Succos: Rain of Torah","https://www.torahanytime.com/lectures/162873"
"R' Labish Becker","Parashat Ha’azinu 5782 – The Secret of the Succah","https://www.torahanytime.com/lectures/162866"
"R' Zvi Zimmerman","Parashat Ha'azinu: The Lost Boys","https://www.torahanytime.com/lectures/162764"
"R' Yehuda Mandel","World of Navardok Ha'azinu 2","https://www.torahanytime.com/lectures/162758"
"R' Eliezer Simcha Lieff","Parashat Ha'azinu: Keep Strengthening Yourself","https://www.torahanytime.com/lectures/162755"
"R' Moshe Tuvia Lieff","Parashat Ha'azinu: It’s All in the Touch","https://www.torahanytime.com/lectures/162730"
"R' Yitzchok Aryeh Epstein","Stimulating stories about Ha'azinu","https://www.torahanytime.com/lectures/162715"
"R' Yosef Chaim Schwab","Gigantic Little Secrets of the Torah: Parashat Ha'azinu","https://www.torahanytime.com/lectures/162699"
"R' Elazar Meisels","The Parashah You Never Knew: Ha'azinu - The Secret of the Most Innocent Pasuk of All","https://www.torahanytime.com/lectures/162566"
"R' Yehuda Mandel","World of Navardok Ha'azinu","https://www.torahanytime.com/lectures/162436"
"R' Daniel Belsky","Parashat Ha'azinu 5780: Understanding The Parasha As Reflected In The Simanim - KALEV Siman (52 Pesukim)","https://www.torahanytime.com/lectures/125815"
"R' Shraga Kallus","Parashat Ha'azinu: The Secret Service","https://www.torahanytime.com/lectures/125520"
"R' Yosef Greenwald","Shabbos Shuvah/Ha'azinu- Hanhagas Hayichud & Covid","https://www.torahanytime.com/lectures/125471"
"R' Moshe Meir Weiss","Ha'azinu Gems 5781","https://www.torahanytime.com/lectures/125463"
"R' Shais Taub","Parashat Ha'azinu: The Silent Student","https://www.torahanytime.com/lectures/125461"
"R' Yosef Chaim Schwab","Gigantic Little Secrets of the Torah: Parashat Ha'azinu Part 5","https://www.torahanytime.com/lectures/125410"
"R' Ephraim Epstein","Shabbos Shuva Drasha: Which Fish Will You Emerge From?","https://www.torahanytime.com/lectures/125391"
"R' Sinai Yakobian","Parashat Ha'azinu: The Song and Joy of Teshuva","https://www.torahanytime.com/lectures/125350"
"R' Ari Goldwag","Yom Kippur-Ha'azinu: Creating a Legacy","https://www.torahanytime.com/lectures/125338"
"R' Yosef Chaim Schwab","Gigantic Little Secrets of the Torah: Parashat Ha'azinu Part 4","https://www.torahanytime.com/lectures/125327"
"R' Zvi Zimmerman","Parashat Ha'azinu: Quick Divrei Torahs","https://www.torahanytime.com/lectures/125326"
"R' Pesach Siegel","Parashat Ha'azinu: Little Man in the Pupil, Based on the Words of Rav Mordechai Gifter","https://www.torahanytime.com/lectures/125316"
"R' Fischel Schachter","Parashat Ha'azinu: Ohr HaChaim - Let The Thin Glass Break","https://www.torahanytime.com/lectures/125303"
"R' Yitzchok Sorotzkin","The Weekly Message From the Rosh Yeshiva","https://www.torahanytime.com/lectures/125296"
"R' Yosef Radner","Parashat Ha'azinu","https://www.torahanytime.com/lectures/125287"
"R' Nosson Greenberg","Ha'azinu 5781- Insights & Divre Torah","https://www.torahanytime.com/lectures/125220"
"R' Gabi Fried","Flying Lessons & Safety Nets!!!","https://www.torahanytime.com/lectures/125179"
"R' Shmuel Silber","Parasha Vort: Fortunate to Forget","https://www.torahanytime.com/lectures/40917"
"R' Yosef Chaim Schwab","Gigantic Little Secrets of the Torah: Parashat Ha'azinu Part 3","https://www.torahanytime.com/lectures/125160"
"R' Gabi Fried","""Reassuming the Mantle of Royalty - True Teshuva!!!","https://www.torahanytime.com/lectures/125132"
"R' Jeremy Golker","Thoughts for Ha'azinu and Yom Kippur 5781","https://www.torahanytime.com/lectures/125124"
"R' Yosef Chaim Schwab","Gigantic Little Secrets of the Torah: Parashat Ha'azinu Part 2","https://www.torahanytime.com/lectures/125104"
"R' Elazar Meisels","The Parashah You Never Knew: Ha'azinu - The Holiest Pasuk of All","https://www.torahanytime.com/lectures/125095"
"R' Naftali Reich","The Shine of Ha'azinu and Yom Kippur","https://www.torahanytime.com/lectures/125091"
"R' Yisroel Brog","Parashat Ha'azinu - The Key to finding your Zivug!","https://www.torahanytime.com/lectures/125023"
"R' Yehuda Mandel","Parashat Ha'azinu","https://www.torahanytime.com/lectures/124977"
"R' YY Rubinstein","The Alshich on Parashat Ha'azinu","https://www.torahanytime.com/lectures/124722"
"R' Zvi Zimmerman","Parashat Ha'azinu: There's a Hunger for Something Bigger","https://www.torahanytime.com/lectures/124565"
"R' Mordechai Aderet","Parashat Ha'azinu / Rosh Hashanah","https://www.torahanytime.com/lectures/124457"
"R' Dovid Kaplan","Parashat Ha'azinu: Water The Crops","https://www.torahanytime.com/lectures/124381"
"R' Yosef Chaim Schwab","Gigantic Little Secrets of the Torah: Parashat Ha'azinu","https://www.torahanytime.com/lectures/92811"
"R' Shlomo Cynamon","Lomdut on Parashat Ha'azinu - ברכת התורה וחלומו של הט""ז","https://www.torahanytime.com/lectures/92805"
"R' Daniel Glatstein","The Haftorah Series Part 74: Parashat Ha'azinu - The Ben Ish Chai Reveals The Kabbalistic Secret for How The Jewish People Refer to the Name of Hashem","https://www.torahanytime.com/lectures/92801"
"R' Moshe Tuvia Lieff","Parashat Ha'azinu: Just The Right Touch Of Rain","https://www.torahanytime.com/lectures/92789"
"R' Yonoson Roodyn","Jewish Destiny - An Open Secret","https://www.torahanytime.com/lectures/92775"
"R' Eliyahu Hartman ZTL","Soul to Soul: Parashat Ha'azinu...Defining the concepts of Vidui and Kedusha","https://www.torahanytime.com/lectures/92771"
"R' Fischel Schachter","Ohr HaChaim: Parashat Ha'azinu - Between Heaven & Earth","https://www.torahanytime.com/lectures/92767"
"R' Zvi Zimmerman","Parashat Ha'azinu: G-d Stoppers?","https://www.torahanytime.com/lectures/92761"
"R' Eytan Feiner","Ha'azinu: Celebrating the Shira of the Torah & It's Mitzvot Post Yom Kippur","https://www.torahanytime.com/lectures/92751"
"R' Gabi Fried","Attitude, Attitude, Attitude!!","https://www.torahanytime.com/lectures/92736"
"R' Yitzchak Botton","From the Darkness Comes the Greatest Light - Ha'azinu With a Twist","https://www.torahanytime.com/lectures/92735"
"R' Dovid Kaplan","Parshat Ha'azinu: Ask Your Elders","https://www.torahanytime.com/lectures/92726"
"R' Avrohom Krohn","Parshat Ha'azinu: The Artwork of Hashem","https://www.torahanytime.com/lectures/92725"
"R' Fischel Schachter","Parashat Ha'azinu: Whats Real/Whats Live","https://www.torahanytime.com/lectures/92710"
"R' Dovid Kaplan","Parshat Ha'azinu: The Oral & Written Torah","https://www.torahanytime.com/lectures/92688"
"R' Mashiach Kelaty","Parashat Ha'azinu: The Rock","https://www.torahanytime.com/lectures/92644"
"R' Ari Goldwag","Ha'azinu: YK-Succos: Love and Judgment","https://www.torahanytime.com/lectures/92620"
"R' Yitzchok Aryeh Epstein","Ha'azinu","https://www.torahanytime.com/lectures/92612"
"R' Daniel Belsky","Parashat Ha'azinu: The Parasha as it expresses the Mitzvot","https://www.torahanytime.com/lectures/67839"
"R' Shlomo Cynamon","Lomdut on Parashat Ha'azinu / Sukkot","https://www.torahanytime.com/lectures/67749"
"R' Naftali Reich","Parashat Ha'azinu: ""The Yom Kippur Red's""","https://www.torahanytime.com/lectures/67720"
"R' Yisroel Simcha Schorr","Sefat Emet on Parashat Ha'azinu","https://www.torahanytime.com/lectures/67718"
"R' Fischel Schachter","Parashat Ha'azinu: Ohr HaChaim - Guided Chances","https://www.torahanytime.com/lectures/67716"
"R' Gabi Fried","Parshat Ha'azinu / Succot / Finding the Connection!","https://www.torahanytime.com/lectures/67714"
"R' Eliezer Ginsburg","Parashat Ha'azinu","https://www.torahanytime.com/lectures/67713"
"R' Baruch Bodenheim","Parashat Ha'azinu: Havu Godel Lelokeinu: When we Bring Forth the Torah Shel Baal Peh that is Inside of Us","https://www.torahanytime.com/lectures/67711"
"R' Zvi Zimmerman","Parashat Ha'azinu: How to get rid of your Demons","https://www.torahanytime.com/lectures/67707"
"R' Nosson Greenberg","Ha'azinu Insights","https://www.torahanytime.com/lectures/67695"
"R' Eliezer Simcha Lieff","Parashat Ha'azinu: Coming Closer To Hashem","https://www.torahanytime.com/lectures/67606"
"R' Moshe Tuvia Lieff","Parashat Ha'azinu: Being Flexible and Firm At the Same Time","https://www.torahanytime.com/lectures/67593"
"R' Mashiach Kelaty","Parashat Ha'azinu: Delirium Tremens","https://www.torahanytime.com/lectures/67505"
"R' Yosef Chaim Schwab","Gigantic Little Secrets of the Torah: Parashat Ha'azinu and Yom Kippur","https://www.torahanytime.com/lectures/67489"
"R' Gabi Fried","Shabat Shuva/Ha'azinu Joining the Inner Circle","https://www.torahanytime.com/lectures/48380"
"R' Eliezer Simcha Lieff","Parashat Ha'azinu","https://www.torahanytime.com/lectures/48304"
"R' Yitzchak Breitowitz","Q and A: Parashat Ha'azinu","https://www.torahanytime.com/lectures/43227"
"R' Eliezer Simcha Lieff","Parashat Ha'azinu: Our Father's Love","https://www.torahanytime.com/lectures/34376"
"R' Eliezer Ginsburg","Parashat Ha'azinu","https://www.torahanytime.com/lectures/34369"
"R' Fischel Schachter","Parashat Ha'azinu: Ohr Hachaim - Rise from the Sand","https://www.torahanytime.com/lectures/34367"
"R' Ari Goldwag","Parashat Ha'azinu: Defying Nature","https://www.torahanytime.com/lectures/34329"
"R' Mashiach Kelaty","Parashat Ha'azinu and Yom Kippur: In The Line Of Fire","https://www.torahanytime.com/lectures/34314"
"R' Moshe Tuvia Lieff","Parashat Ha'azinu: We Make History","https://www.torahanytime.com/lectures/34312"
"R' Mordechai Finkelman","Parashat Ha'azinu: Speaking to the Soul","https://www.torahanytime.com/lectures/34232"
"R' Yisroel Belsky ZTL","Parashat Ha'azinu","https://www.torahanytime.com/lectures/21922"
"R' Fischel Schachter","Parashat Ha'azinu: Ohr HaChaim - Move On","https://www.torahanytime.com/lectures/21885"
"R' Ari Goldwag","Parashat Ha'azinu and Sukkot: Song of Joy","https://www.torahanytime.com/lectures/21867"
"R' Moshe Tuvia Lieff","Parashat Ha'azinu","https://www.torahanytime.com/lectures/21863"
"R' Mashiach Kelaty","Parashat Ha'azinu: Vengeance Is Mine","https://www.torahanytime.com/lectures/21856"
"R' Ephraim Lever","Parashat Ha'azinu: Like Rain and Dew","https://www.torahanytime.com/lectures/21855"
"R' Yitzchok Isbee ZT""L","TT_52_Ha'azinu","https://www.torahanytime.com/lectures/20567"
"R' Yosef Chaim Schwab","Parashat Ha'azinu","https://www.torahanytime.com/lectures/13803"
"R' Eytan Feiner","Parashat Ha'azinu: The Demise of Moshe Rabbeinu","https://www.torahanytime.com/lectures/13365"
"R' Ari Goldwag","Parashat Ha'azinu: Silence of the Moon","https://www.torahanytime.com/lectures/13312"
"R' Yosef Chaim Schwab","Parashat Ha'azinu","https://www.torahanytime.com/lectures/4352"
"R' Ari Goldwag","Parashat Ha'azinu: Hashem's Crown of Dew","https://www.torahanytime.com/lectures/3989"
"R' Mashiach Kelaty","People Get Ready","https://www.torahanytime.com/lectures/3970"
"R' Dovid Kaplan","Parashat Ha'azinu Part 1","https://www.torahanytime.com/lectures/417"
"R' Dovid Kaplan","Parashat Ha'azinu Part 2","https://www.torahanytime.com/lectures/416"
"R' Eytan Feiner","Parashat Ha'azinu: The Demise of Moshe Rabbeinu","https://www.torahanytime.com/lectures/13365"
"R' Ari Goldwag","Parashat Ha'azinu: Silence of the Moon","https://www.torahanytime.com/lectures/13312"
"R' Yosef Chaim Schwab","Parashat Ha'azinu","https://www.torahanytime.com/lectures/4352"
"R' Ari Goldwag","Parashat Ha'azinu: Hashem's Crown of Dew","https://www.torahanytime.com/lectures/3989"
"R' Mashiach Kelaty","People Get Ready","https://www.torahanytime.com/lectures/3970"
"R' Dovid Kaplan","Parashat Ha'azinu Part 1","https://www.torahanytime.com/lectures/417"
"R' Dovid Kaplan","Parashat Ha'azinu Part 2","https://www.torahanytime.com/lectures/416"
