"author","title","link"
"R' Uren Reich","Parashat Lech Lecha","https://www.torahanytime.com/lectures/395961"
"R' Sholom Ahron Ehrenfeld","Not Emotions Rather TRUTH - repost","https://www.torahanytime.com/lectures/390902"
"R' Chanina Weinberg","Passing the big test","https://www.torahanytime.com/lectures/333395"
"R' Eliezer Ginsburg","Parshat Lech Lecha","https://www.torahanytime.com/lectures/333150"
"R' Eliezer Ginsburg","Tefilah of Avrohom","https://www.torahanytime.com/lectures/333146"
"R' Chanina Weinberg","How to pass the big test","https://www.torahanytime.com/lectures/332634"
"R' Binyamin Lavian","Parashat Lech lecha - Avraham Avinu coming to help a minyan & why did Avraham Avinu accept gifts","https://www.torahanytime.com/lectures/332443"
"R' Binyamin Lavian","Parashat Lech lecha - Haftarah & why did Hashem exempt Avraham Avinu from kivud Av","https://www.torahanytime.com/lectures/332442"
"R' Baruch Bodenheim","Parashat Lech Lecha: Setting In Motion","https://www.torahanytime.com/lectures/332179"
"R' Berel Wein ZTL","Parashat Lech Lecha: Challenges!","https://www.torahanytime.com/lectures/331529"
"R' Ephraim Eliyahu Shapiro","Parsha Insights: Parshas Lech Lecha","https://www.torahanytime.com/lectures/331520"
"R' Shmuel Zucker","Lech Lecha - Real Reward Comes After Hardship","https://www.torahanytime.com/lectures/331510"
"R' Menachem Feifer","ParshasLech Lecha: The Light in the Dark","https://www.torahanytime.com/lectures/331416"
"R' Yosef Greenfeld","Suicide Bombers and Tunnels in Iraq","https://www.torahanytime.com/lectures/331350"
"R' Ariel Mizrahi","Influencer, not Influenced","https://www.torahanytime.com/lectures/331262"
"R' Kalman Worch","Zera Kodesh- Lech Lecha-Where Are You From","https://www.torahanytime.com/lectures/331119"
"Special Event","Rabbi Moshe Sorotzkin- Iran to Amsterdam","https://www.torahanytime.com/lectures/331092"
"R' Yosef Viener","Parshas Lech Lecha: Staying On Course Without Messages of Encouragement","https://www.torahanytime.com/lectures/331064"
"R' Simcha Bunim Berger","Maharal on Parshas Lech Lecha","https://www.torahanytime.com/lectures/331063"
"R' Doniel Neustadt","Seder Shalom Rav - Parashat Lech Lecha","https://www.torahanytime.com/lectures/331046"
"R' Daniel Glatstein","Lech Lecha: The Arizal Reveals the Earthshattering Rescue of the Soul of Rava Hidden in Lot","https://www.torahanytime.com/lectures/331022"
"R' Daniel Glatstein","Where Did Perek Shira Come From? Who Wrote it? - Part 2","https://www.torahanytime.com/lectures/330959"
"R' Michel Twerski","Lech Lecha - Erev Shabbos","https://www.torahanytime.com/lectures/331006"
"R' Moshe Bamberger","Parshas Lech Lecha: The Road to Self-Discovery","https://www.torahanytime.com/lectures/330996"
"R' Elyahou Quedoshim","Parshas Lech Lecha","https://www.torahanytime.com/lectures/330997"
"R' Shmuel Schabes","Parshas Lech Lecha: Putting It All On The Line","https://www.torahanytime.com/lectures/330992"
"R' Avrohom Stulberger","Navigating Bitachon - Lech Lecha 5785","https://www.torahanytime.com/lectures/330989"
"R' Meyer Yedid","Parashat Lech Lecha: The Land That I Will Show You","https://www.torahanytime.com/lectures/330988"
"R' Yosef Radner","Parshas Lech Lecha","https://www.torahanytime.com/lectures/330984"
"R' Doniel Osher Kleinman","Parshas Lech Lecha:Tefillin - Do You Know Where Your Head Is?","https://www.torahanytime.com/lectures/330980"
"R' Yosef Radner","Parshas Lech Lecha","https://www.torahanytime.com/lectures/330984"
"R' Doniel Osher Kleinman","Parshas Lech Lecha:Tefillin - Do You Know Where Your Head Is?","https://www.torahanytime.com/lectures/330980"
"R' Motti Kesserman","לֶךְ־לְךָ. לַהֲנָאָתְךָ וּלְטוֹבָתְךָ! Go & Keep Going Until You Get There","https://www.torahanytime.com/lectures/330974"
"R' Efraim Twerski","Lech Licha-Not Wisdom, Might or Wealth","https://www.torahanytime.com/lectures/330954"
"R' Mordechai Aderet","Parashat Aderet Lech Lecha 2024 (connecting Motzi and Partnership)","https://www.torahanytime.com/lectures/330949"
"R' Yaakov Harari","The steadfast Emunah of Avraham Avinu","https://www.torahanytime.com/lectures/330950"
"R' Moshe Tuvia Lieff","Rav Tzadok Shiur - Lech Lecha","https://www.torahanytime.com/lectures/330943"
"R' Label Lam","Parashat Lech Lecha: The One Who Heard","https://www.torahanytime.com/lectures/330947"
"R' Moshe Tuvia Lieff","Rav Tzadok Chabura - Lech Lecha","https://www.torahanytime.com/lectures/330942"
"R' Alexander Coleman","My ""Lot"" in Life","https://www.torahanytime.com/lectures/330935"
"R' Menashe Frankel","Parshas Lech Lecha - Chumash Shiur","https://www.torahanytime.com/lectures/330940"
"R' Shlomo Farhi","Lech Lecha: Keep On Keeping On","https://www.torahanytime.com/lectures/330929"
"R' Yosef Greenwald","5785 Lech Lecha- בעניני הותרה ודחויה בפקו''נ בשבת ושאר איסורים(שו''ט בדברי הראשונים בענין שחיטה בשביל חולה בשבת),ובהיתר ייבום ומילה","https://www.torahanytime.com/lectures/330930"
"R. Leah Kohn","Lech Lecha: Avraham's Life - Walking Before Hashem","https://www.torahanytime.com/lectures/330924"
"R' Fischel Schachter","Parshas Lech Lecha: Ohr HaChaim - Light In The Unknown","https://www.torahanytime.com/lectures/330922"
"R' Asher Weiss","Short Thought on Parshat Lech Lecha","https://www.torahanytime.com/lectures/330894"
"R' Shmuel Schwarz","Thursday Shmuz - Lech Lucho - Achieving YOUR life mission!","https://www.torahanytime.com/lectures/330911"
"R' Shraga Kallus","Parshas Lech Lecha - From The Curses Come The Brochos","https://www.torahanytime.com/lectures/330907"
"R' Ari Goldwag","Lech Lecha - Smashing Idols","https://www.torahanytime.com/lectures/330893"
"R' Asher Weiss","Parshat Lech Lecha: The Definition of Mitzvas Millah","https://www.torahanytime.com/lectures/330891"
"R' Shmuel Zucker","Lech Lecha - Awaken Your Neshama","https://www.torahanytime.com/lectures/330888"
"R' Chaim Eisenstein","Nesivos Shalom Parshat Lech Lecha","https://www.torahanytime.com/lectures/330890"
"R' Shraga Feivel Zimmerman","Was Lot a Tzadik or a Rasha","https://www.torahanytime.com/lectures/330885"
"R' Daniel Belsky","Parashat Lech Lecha 5785: The big suprise -- Avraham Avinu","https://www.torahanytime.com/lectures/330878"
"R' Simcha Bunim Berger","Zera Shimshon Lech Lecha","https://www.torahanytime.com/lectures/330868"
"R' Yisroel Apelbaum","Being steadfast in your Yiddishkeit","https://www.torahanytime.com/lectures/330854"
"R' Ezriel Cziment","The Core of a Nisayon","https://www.torahanytime.com/lectures/330856"
"R' Yosef Greenwald","Lech Lecha-ומצאת את לבבו נאמן לפניך Vs. נח מקטני אמנה היה","https://www.torahanytime.com/lectures/330850"
"R' Naftali Klein","Noam Elimelech Parshat Lech Lecha 5785- Should I be Proud to be a Grandson of The Rebbe Reb Meilech?","https://www.torahanytime.com/lectures/330840"
"R' Daniel Kalish","The Avrahom Brand of Chesed [Blue Ridge Mishmar]","https://www.torahanytime.com/lectures/330847"
"R' Yitzchok Schwartz","Parashas Lech Lecha","https://www.torahanytime.com/lectures/330845"
"R' Alexander Seinfeld","What Does Avraham Avinu Teach Us About Earning Hashem's Love?","https://www.torahanytime.com/lectures/330836"
"R' Moshe Don Kestenbaum","Desires Isolate Us From Others and Our True Selves","https://www.torahanytime.com/lectures/330828"
"R' Zvi Zimmerman","Parashat Lech Lecha: A Shepherd Fight","https://www.torahanytime.com/lectures/330815"
"R' Yosef Chaim Schwab","Parshas Lech Lecha Part 2: The 5 Most Important Subjects of the Parsha","https://www.torahanytime.com/lectures/330822"
"R' Ilan Halberstadt","Parshas Lech Lecha: Avraham - The Beracha of the World","https://www.torahanytime.com/lectures/330823"
"R' Label Lam","Parashat Lech Lecha - What’s the Test","https://www.torahanytime.com/lectures/330818"
"R' Moshe Meir Weiss","For the Shabbos Table Lech Lcha 5785","https://www.torahanytime.com/lectures/330805"
"R' Shmuel Greenberg","Avraham Avinu in Danger and all He Thinks About is Presents","https://www.torahanytime.com/lectures/330810"
"R' Yehuda Mandel","World of Navardok Lech Lecha 2-5785","https://www.torahanytime.com/lectures/330801"
"R' Michel Twerski","Lech Lecha - Thursday","https://www.torahanytime.com/lectures/330807"
"R' Shlomo Cynamon","Lomdut on Lech Lecha: Who is a Yid?","https://www.torahanytime.com/lectures/330782"
"R' Moshe Donnebaum","The World's First Chosid !!","https://www.torahanytime.com/lectures/330777"
"R' Eytan Feiner","Avraham's Seeing Sarah, an Amazing Chofetz Chaim Story, & a $500 Tie...","https://www.torahanytime.com/lectures/330776"
"R' Yehoshua Landau","Lech Lecha ,Our Journey To Humility","https://www.torahanytime.com/lectures/330774"
"R' Zvi Gefen","Rising up to Life's Challenges","https://www.torahanytime.com/lectures/330775"
"R' Shaul Haber","Parashat lech lecha: The only way to tranquility","https://www.torahanytime.com/lectures/330770"
"R' Yisroel Brog","Parashat Lech Lecha - Understanding the Arab interaction","https://www.torahanytime.com/lectures/330766"
"R' Moshe Tuvia Lieff","Parashat Lech Lecha Halacha: Greet someone, and Get a Mitzvah","https://www.torahanytime.com/lectures/330754"
"R' Ariel Mizrahi","Young and Old","https://www.torahanytime.com/lectures/330747"
"Mrs. Amit Yaghoubi","Lech Lecha: Learn How to Expand Yourself to Receive More Blessing","https://www.torahanytime.com/lectures/330738"
"R' Yisroel Apelbaum","Understanding לוט’s separation from אברהם","https://www.torahanytime.com/lectures/330740"
"R' Leiby Burnham","Lech Lecha - Don't show me your vicitim card!","https://www.torahanytime.com/lectures/330731"
"R' Shraga Kallus","Parshas Lech Lecha - The Seminary Girls Nisayon","https://www.torahanytime.com/lectures/330741"
"R' Yosef Palacci","Parashat Lech Lecha - Three Awesome Lessons from Avraham Avinu","https://www.torahanytime.com/lectures/330734"
"R' Dovid Rosman","Lech Lecha: 5 Short Yet Deep Divrei Torah","https://www.torahanytime.com/lectures/330730"
"R' Tzvi Sytner","Lech Lecha: Don't Give Up! Just Keep Going!!!","https://www.torahanytime.com/lectures/330708"
"R' Yochanan Cohen","P'Lech Lecha- Chumish shiur#5","https://www.torahanytime.com/lectures/330645"
"R' Yossi Michalowicz","Lech Lecha - Timely Advice For The President Elect","https://www.torahanytime.com/lectures/330696"
"R' Moshe Yosef Eckstein","Lessons From the Nisyonos of Avraham","https://www.torahanytime.com/lectures/330668"
"R' Shraga Kallus","Parshas Lech Lecha - Chassid, Litvak, Lamdan and Mekubal","https://www.torahanytime.com/lectures/330695"
"R' Naftali Reich","Parshas Lech Lecha: ""Bitachon Uncorked""","https://www.torahanytime.com/lectures/330692"
"R' Avrohom Waxman","בִּשְׂכַר שֶׁאָמַר אַבְרָהָם אָבִינוּ ״אִם מִחוּט וְעַד שְׂרוֹךְ נַעַל״, זָכוּ בָּנָיו לִשְׁתֵּי מִצְוֹת: חוּט שֶׁל תְּכֵלֶת וּרְצוּעָה שֶׁל תְּפִלִּין! Understanding The Connection And Their Message","https://www.torahanytime.com/lectures/330690"
"R' Shlomo Farhi","Lech Lecha: Travel Difficulty","https://www.torahanytime.com/lectures/330666"
"R' Yechezkel Hartman","The Chesed of Avraham Avinu - Hakaras Hatov","https://www.torahanytime.com/lectures/330658"
"R' Meir Kahane","Aish Kodesh- Lech Lecha (Succos), 5702, Expanding My Relationship With Hashem (2021/22 Series- Enhanced III)","https://www.torahanytime.com/lectures/330652"
"R' Ori Strum","How Did YOU Find Hashem? Unearthing the Torah's Seemingly Strange Omission of Avraham's Backstory","https://www.torahanytime.com/lectures/330651"
"R' Yochanan Cohen","P'Lech Lecha- Chumish shiur#4","https://www.torahanytime.com/lectures/330643"
"R' Dovid Eisenberg","If I offered you a lot of money, you'd also move. What's Avraham Avinu's test?","https://www.torahanytime.com/lectures/330626"
"R' Dovid Kaplan","Is It Good for the Jews - Lech Lecha","https://www.torahanytime.com/lectures/330619"
"R' Ariel Mizrahi","Giving your Kids an Edge","https://www.torahanytime.com/lectures/330604"
"R' Shmuel Schwarz","Alshich - Lech Lucho - The deeper meaning of Bris Mila part 1","https://www.torahanytime.com/lectures/330582"
"R' Shmuel Schwarz","Lech Lucho - Traits series P9 - Acceptance! how to accept the situations and circumstances Hashem puts us in.","https://www.torahanytime.com/lectures/330583"
"R' Jeremy Golker","Parsha Shiur: Lech Lecha","https://www.torahanytime.com/lectures/330575"
"R' Yitzchok Aryeh Epstein","Stimulating stories about Lech Lecha","https://www.torahanytime.com/lectures/330541"
"Mr. Josh Brody","Lech Lecha- Emunah, Its Not (About) What You Think","https://www.torahanytime.com/lectures/330562"
"R' Fischel Schachter","Appreciate the knots","https://www.torahanytime.com/lectures/330551"
"R' Ari Neuwirth","Lech Lecha - ""Finding Happiness Through Stability: The Foundation For a Fulfilled Life""","https://www.torahanytime.com/lectures/330543"
"R' Yitzchok Aryeh Epstein","Parshas Lech Lecha like you have never heard before","https://www.torahanytime.com/lectures/330540"
"R' Daniel Glatstein","Lech Lecha: Emuna From Nature or Torah - Which is Greater?","https://www.torahanytime.com/lectures/330531"
"R' Michel Twerski","Lech Lecha - Wednesday","https://www.torahanytime.com/lectures/330528"
"R' Motti Neuburger","Fascinating Fact: H's Name 'YKVK' is only Missing from Two Parshios' Which 2 & Why??","https://www.torahanytime.com/lectures/330511"
"R' Yisroel Brog","Parashat Lech Lecha - Understanding the benefits of yissurim","https://www.torahanytime.com/lectures/330504"
"R' Yitzchak Botton","FREE YOUR SOUL - Find the Real YOU & You'll Find the TRUTH!","https://www.torahanytime.com/lectures/330500"
"R' Joey Haber","Parashat Lech Lecha: When You Want to Give Up","https://www.torahanytime.com/lectures/330496"
"R' Gabi Fried","Up, Up, and Away!!!","https://www.torahanytime.com/lectures/330482"
"R' Yehoshua Nissan","Time to Give Up Your Prophecy","https://www.torahanytime.com/lectures/330483"
"R' Yehoshua Nissan","Why Was I Dealt a Bad Hand?","https://www.torahanytime.com/lectures/330469"
"R' Mordechai Salfer","Maasai Avos Simin L’Bonim: How YOU can protect your descendants (Story with Shimon Ben Shatach)","https://www.torahanytime.com/lectures/330461"
"R' Eliezer Simcha Lieff","Parashat Lech Lecha: Withstanding The Tests","https://www.torahanytime.com/lectures/330393"
"R' Moshe Tuvia Lieff","Parashat Lech Lecha - Every Yid is a Big ... STAR","https://www.torahanytime.com/lectures/330196"
"R' Dovid Kaplan","The First World War - Lech Lecha","https://www.torahanytime.com/lectures/330390"
"R' Avrohom Zeidman","Lech Lecha: How is 'Jewish protexia' fair or even just?","https://www.torahanytime.com/lectures/330391"
"R' Eytan Feiner","Hashem's First Words to the World's First Jew","https://www.torahanytime.com/lectures/330385"
"R' Yehoshua Nissan","Trump & Harris Can't Change This","https://www.torahanytime.com/lectures/330383"
"R' Shmuel Zucker","Lech Lecha - Discovering the Real 'You'","https://www.torahanytime.com/lectures/330342"
"R' Eliyahu Maksumov","Parashat Lech Lecha - Avraham vs. Nimrod The Untold Story","https://www.torahanytime.com/lectures/330322"
"R' Yochanan Cohen","P'Lech Lecha-Chumish shiur #3","https://www.torahanytime.com/lectures/330324"
"R' Yehoshua Nissan","Noach & Avraham Are Not Your Classmates","https://www.torahanytime.com/lectures/330306"
"R' Yosef Chaim Schwab","Parashat Lech Lecha Part 1: The Forged Ramban","https://www.torahanytime.com/lectures/330285"
"R' Mordechai Aderet","Parashat Lech Lecha: Be like Avraham / Partner of Creation","https://www.torahanytime.com/lectures/330278"
"R. Iris Odani Elyashiv","The Goal of the journeys of man in this world , Parashat Lech Lecha .","https://www.torahanytime.com/lectures/330275"
"R' Ephraim Epstein","The Birth of Kindness","https://www.torahanytime.com/lectures/330274"
"R' Yaakov Harari","A strong foundation of Emuna","https://www.torahanytime.com/lectures/330266"
"R' Yehoshua Nissan","Gems on the Parsha","https://www.torahanytime.com/lectures/330263"
"R' Yisroel Brog","Parashat Lech Lecha - Protecting yourself from your surroundings","https://www.torahanytime.com/lectures/330249"
"R' Dovid Eisenberg","Parsha Power for Kids: Making a Kiddush Hashem","https://www.torahanytime.com/lectures/330243"
"R' Mordechai Salfer","This is how we are 1st introduced to Avram? And he is offered this for his personal benefit?!","https://www.torahanytime.com/lectures/330187"
"R' Eli Garfinkel","איך רצה אברהם לקבל מתנות מפרעה, והא שונא מתנות יחיה?","https://www.torahanytime.com/lectures/330171"
"R' Michel Twerski","Lech Lecha - Tuesday","https://www.torahanytime.com/lectures/330174"
"R' Avraham Jacobowitz","Lech Lecha: The Fascinating Art of Pleasure","https://www.torahanytime.com/lectures/330175"
"R' Michel Twerski","Lech Lecha - Monday","https://www.torahanytime.com/lectures/330152"
"R' Yisroel Brog","Parashat Lech Lecha - Avraham Avinu's motivations","https://www.torahanytime.com/lectures/330114"
"R' Yehoshua Sova","Lech Lecha Women's Shiur 5785","https://www.torahanytime.com/lectures/330115"
"R' Dovid Kaplan","Payback - Lech Lecha","https://www.torahanytime.com/lectures/330111"
"R' Labish Becker","Lech Le'cha 5785 - ""The Eternity Conundrum""","https://www.torahanytime.com/lectures/330110"
"R' Yochanan Cohen","P'Lech Lecha-Nothing is free","https://www.torahanytime.com/lectures/330079"
"R' Yochanan Cohen","P'Lech Lecha-Chumish shiur #2","https://www.torahanytime.com/lectures/330078"
"R. Iris Odani Elyashiv","Hilula Rabbi Ovadya Yosef Zt""l zya""a . Parashat Lech lecha .","https://www.torahanytime.com/lectures/330060"
"R' Meir Simcha Sperling","Current Events: The Israeli War, Election Day, And The Final Battle Of Gog And Magog","https://www.torahanytime.com/lectures/330034"
"R' Eliezer Krohn","The Power Within","https://www.torahanytime.com/lectures/330035"
"R' Yosef Greenwald","Lech Lecha-Mitzvas Yishuv Eretz Yisrael(From Avrohom Aveinu until Today)","https://www.torahanytime.com/lectures/329952"
"R' Motti Neuburger","Did We Really Get Tefillin & T'chayles Because of Avraham? Didn't All the Mitzvot in Torah Precede the World?","https://www.torahanytime.com/lectures/330019"
"R' Yitzchok Schwartz","Parashas Lech Lecha 5781- Lilui nishmas Genendel bas R' Pesach (Nagel)","https://www.torahanytime.com/lectures/330015"
"R' Yitzchok Schwartz","Parashas Lech Lecha 5780- Lilui nishmas Genendel bas R' Pesach (Nagel)","https://www.torahanytime.com/lectures/330014"
"R' Yitzchok Schwartz","Parashas Lech Lecha 5779- Lilui nishmas Genendel bas R' Pesach (Nagel)","https://www.torahanytime.com/lectures/330013"
"R' Mordechai Lebhar","Parashat Lech Lecha: A Jew's Approach to Elections","https://www.torahanytime.com/lectures/330002"
"R' Yitzchok Schwartz","Parashas Lech Lecha 5778- Lilui nishmas Genendel bas R' Pesach (Nagel)","https://www.torahanytime.com/lectures/330012"
"R' Yitzchok Schwartz","Parashas Lech Lecha 5777- Lilui nishmas Genendel bas R' Pesach (Nagel)","https://www.torahanytime.com/lectures/330011"
"R' Yitzchok Schwartz","Parashas Lech Lecha 5773- Lilui nishmas Genendel bas R' Pesach (Nagel)","https://www.torahanytime.com/lectures/330008"
"R' Yitzchok Schwartz","Parashas Lech Lecha 5772- Lilui nishmas Genendel bas R' Pesach (Nagel)","https://www.torahanytime.com/lectures/330007"
"R' Yitzchok Schwartz","Parashas Lech Lecha 5771- Lilui nishmas Genendel bas R' Pesach (Nagel)","https://www.torahanytime.com/lectures/330006"
"R' Shlomo Farhi","Lech Lecha: Avraham Avinu","https://www.torahanytime.com/lectures/329996"
"R' Zalmen Sorotzkin","Understanding And Striving To Learn Toras Chesed","https://www.torahanytime.com/lectures/329986"
"R' Avrohom Walkin","Parashat Lech Lecha: One Man Stands Alone","https://www.torahanytime.com/lectures/329965"
"R' Shlomo Farhi","Lech Lecha: The Land I Will Show You","https://www.torahanytime.com/lectures/329960"
"R' Daniel Glatstein","Lech Lecha : Overcoming Hopelessness With Bitachon - Combining the Stunning Insights of Rav Tzadok & the Bas Ayin","https://www.torahanytime.com/lectures/329930"
"R' Ariel Mizrahi","Positive Ridicule","https://www.torahanytime.com/lectures/329921"
"R' Dovid Kaplan","Keep Moving - Lech Lecha","https://www.torahanytime.com/lectures/329887"
"R' Yochanan Cohen","P'Lech Lecha- Chumish shiur#1","https://www.torahanytime.com/lectures/329894"
"R' Yehoshua Balkany","Torah Insights Parashas Lech Lecha","https://www.torahanytime.com/lectures/329851"
"R' Yonah Sklare","Parshas Lech Lecha: Avraham's Holy Chutzpa","https://www.torahanytime.com/lectures/329838"
"R' Yehuda Mandel","World of Navardok Lech Lecha 1-5785","https://www.torahanytime.com/lectures/329819"
"R' Eliezer Krohn","A Puah Pilpul On The Parshah Part Two Fulfilling Pru U'rvu Through IVF","https://www.torahanytime.com/lectures/329814"
"R' Eytan Feiner","Appreciating Sarah's Uniqueness: ""Succos"" is Not Yet Over!","https://www.torahanytime.com/lectures/329806"
"R' Yitzchak Ahron Goldhirsh","Parshas Lech Lecha","https://www.torahanytime.com/lectures/329780"
"R' Yitzchok Fingerer","The Arab Doctor Who Did a Bris and Other Fascinating Shailos","https://www.torahanytime.com/lectures/329790"
"R' Mordechai Finkelman","Parshas Lech Lecha: Derech Eretz Kadma... In the Torah","https://www.torahanytime.com/lectures/329765"
"R' Benzion Twerski","Contrasting Noach with Lech Lecha - Torah and Tefillah","https://www.torahanytime.com/lectures/329758"
"R' Nosson Nussbaum","Parshas: Lech Lecha","https://www.torahanytime.com/lectures/329727"
"R' Daniel Glatstein","Lech Lecha: Is Tzitzis From Sheim or Avraham? The Amazing Exposition of Rav Shalom Schechter","https://www.torahanytime.com/lectures/329717"
"R' Elazar Meisels","Seforno Gems: Marketing Advice from Avraham Avinu","https://www.torahanytime.com/lectures/329654"
"R' Daniel Glatstein","Torah Parenting for the 21st Generation {Yeshiva Tiferes Moshe Melave Malka}","https://www.torahanytime.com/lectures/329651"
"R' Mashiach Kelaty","Ohr Hachaim on the Torah Ep. 163 - The Yehudah ben Moshe Institute - Chapter 17, v.20-v.27","https://www.torahanytime.com/lectures/318425"
"R' Mashiach Kelaty","Ohr Hachaim on the Torah Ep. 162 - The Yehudah ben Moshe Institute - Chapter 17, v.6-v.19","https://www.torahanytime.com/lectures/318084"
"R' Mashiach Kelaty","Ohr Hachaim on the Torah Ep. 161 - The Yehudah ben Moshe Institute - Chapter 17, v.1-v.5","https://www.torahanytime.com/lectures/317899"
"R' Mashiach Kelaty","Ohr Hachaim on the Torah Ep. 160 - The Yehudah ben Moshe Institute - Chapter 16, v.5 pt.5","https://www.torahanytime.com/lectures/317771"
"R' Mashiach Kelaty","Ohr Hachaim on the Torah Ep. 159 - The Yehudah ben Moshe Institute - Chapter 16, v.5 pt.4","https://www.torahanytime.com/lectures/317583"
"R' Mashiach Kelaty","Ohr Hachaim on the Torah Ep. 158 - The Yehudah ben Moshe Institute - Chapter 16, v.5 pt.3","https://www.torahanytime.com/lectures/317369"
"R' Mashiach Kelaty","Ohr Hachaim on the Torah Ep. 157 - The Yehudah ben Moshe Institute - Chapter 16, v.5 pt.2","https://www.torahanytime.com/lectures/316953"
"R' Mashiach Kelaty","Ohr Hachaim on the Torah Ep. 156 - The Yehudah ben Moshe Institute - Chapter 16, v.5 pt.1.","https://www.torahanytime.com/lectures/316680"
"R' Mashiach Kelaty","Ohr Hachaim on the Torah Ep. 155 - The Yehudah ben Moshe Institute - Chapter 15, v.18-21","https://www.torahanytime.com/lectures/316417"
"R' Mashiach Kelaty","Ohr Hachaim on the Torah Ep. 154 - The Yehudah ben Moshe Institute - Chapter 15, v.16 pt.3, v.17","https://www.torahanytime.com/lectures/315948"
"R' Mashiach Kelaty","Ohr Hachaim on the Torah Ep. 153 - The Yehudah ben Moshe Institute - Chapter 15, v.16 pt.2","https://www.torahanytime.com/lectures/315550"
"R' Mashiach Kelaty","Ohr Hachaim on the Torah Ep. 152 - The Yehudah ben Moshe Institute - Chapter 15, v.16 pt.1","https://www.torahanytime.com/lectures/315308"
"R' Mashiach Kelaty","Ohr Hachaim on the Torah Ep. 151 - The Yehudah ben Moshe Institute - Chapter 15, v.15","https://www.torahanytime.com/lectures/315075"
"R' Mashiach Kelaty","Ohr Hachaim on the Torah Ep. 150 - The Yehudah ben Moshe Institute - Chapter 15, v.14 pt.3","https://www.torahanytime.com/lectures/314741"
"R' Mashiach Kelaty","Ohr Hachaim on the Torah Ep. 149 - The Yehudah ben Moshe Institute - Chapter 15, v.14 pt.2","https://www.torahanytime.com/lectures/314392"
"R' Mashiach Kelaty","Ohr Hachaim on the Torah Ep. 148 - The Yehudah ben Moshe Institute - Chapter 15, v.14 pt.1","https://www.torahanytime.com/lectures/313958"
"R' Mashiach Kelaty","Ohr Hachaim on the Torah Ep. 147 - The Yehudah ben Moshe Institute - Chapter 15, v.13 pt.2","https://www.torahanytime.com/lectures/313582"
"R' Mashiach Kelaty","Ohr Hachaim on the Torah Ep. 146 - The Yehudah ben Moshe Institute - Chapter 15, v.7-13 pt.1","https://www.torahanytime.com/lectures/313283"
"R' Mashiach Kelaty","Ohr Hachaim on the Torah Ep. 145 - The Yehudah ben Moshe Institute - Chapter 15, v.4-6","https://www.torahanytime.com/lectures/313073"
"R' Mashiach Kelaty","Ohr Hachaim on the Torah Ep. 144 - The Yehudah ben Moshe Institute - Chapter 15, v.1-3","https://www.torahanytime.com/lectures/312826"
"R' Mashiach Kelaty","Ohr Hachaim on the Torah Ep. 143 - The Yehudah ben Moshe Institute - Chapter 14, v.22-24","https://www.torahanytime.com/lectures/312471"
"R' Mashiach Kelaty","Ohr Hachaim on the Torah Ep. 142 - The Yehudah ben Moshe Institute - Chapter 14, v.21","https://www.torahanytime.com/lectures/312129"
"R' Mashiach Kelaty","Ohr Hachaim on the Torah Ep. 141 - The Yehudah ben Moshe Institute - Chapter 14, v.19-v.20","https://www.torahanytime.com/lectures/311720"
"R' Mashiach Kelaty","Ohr Hachaim on the Torah Ep. 140 - The Yehudah ben Moshe Institute - Chapter 14, v.16-v.18","https://www.torahanytime.com/lectures/311565"
