"author","title","link"
"Rabbi Joseph B. Soloveitchik","Toldos","https://www.yutorah.org/lectures/details?shiurid=767955"
"Rabbi Ahron Soloveichik","The Leitzanei Hador","https://www.yutorah.org/lectures/details?shiurid=772098"
"Rabbi Mordechai I. Willig","Baruch Shepatrani Meionsho Shel Zeh","https://www.yutorah.org/lectures/details?shiurid=704141"
"Rabbi Herzl Hefter","Why did Yitzchak Love Esav?","https://www.yutorah.org/lectures/details?shiurid=754483"
"Rabbi Moshe Taragin","Parshat Toldos","https://www.yutorah.org/lectures/details?shiurid=1113351"
"Rabbi Beinish Ginsburg","Toldos - Yitzchak's role as one of the Avos","https://www.yutorah.org/lectures/details?shiurid=729467"
"Rabbi Beinish Ginsburg","030 Toldos - Vayetzei-Maariv","https://www.yutorah.org/lectures/details?shiurid=729468"
"Rabbi Yosef Blau","The Qualities of Yitzchak","https://www.yutorah.org/lectures/details?shiurid=706319"
"Rabbi Meir Goldwicht","Toldos 5765","https://www.yutorah.org/lectures/details?shiurid=706388"
"Rabbi Yaakov B. Neuburger","Did the Avos Keep the Torah","https://www.yutorah.org/lectures/details?shiurid=706396"
"Rabbi Baruch Simon","Toldos 5765","https://www.yutorah.org/lectures/details?shiurid=706398"
"Rabbi Zev Reichman","Parshas Toldos Yitzchak and Yismael Keneged Chanukah","https://www.yutorah.org/lectures/details?shiurid=706436"
"Rabbi Dovid Gottlieb","Suma B'Mitzvos","https://www.yutorah.org/lectures/details?shiurid=712371"
"Rabbi Zvi Romm","Haftarat Toldot - Hashem's Love for Us","https://www.yutorah.org/lectures/details?shiurid=750060"
"Rabbi Meir Goldwicht","Parshas Toldot","https://www.yutorah.org/lectures/details?shiurid=712774"
"Rabbi Yonason Sacks","Toldos 5766","https://www.yutorah.org/lectures/details?shiurid=712782"
"Rabbi Dovid Miller","Why is Yitzchak's Blessing in the Merit of Avraham?","https://www.yutorah.org/lectures/details?shiurid=712824"
"Rabbi Amos Luban","Toldot 1: The Final Selection - Who Will be the Carrier of the Bracha?","https://www.yutorah.org/lectures/details?shiurid=890157"
"Rabbi Ally Ehrman","Chariots Of Fire","https://www.yutorah.org/lectures/details?shiurid=720376"
"Rabbi Ally Ehrman","Toldos: Finding G-d In The Mundane","https://www.yutorah.org/lectures/details?shiurid=720435"
"Rabbi Aharon Kahn","Holding Ourselves to a Higher Standard","https://www.yutorah.org/lectures/details?shiurid=720460"
"Rabbi Michoel Zylberman","Did the Avos Keep the Torah?: Parshas Toldot - Ramban al haTorah","https://www.yutorah.org/lectures/details?shiurid=721652"
"Rabbi Ally Ehrman","Yaakov, Eisav, Deception And .... Self-Deception","https://www.yutorah.org/lectures/details?shiurid=720451"
"Rabbi Avraham Shulman","Toldos: Defining Truth - When is it a Mitzvah to Lie?","https://www.yutorah.org/lectures/details?shiurid=721555"
"Rabbi Michael Taubes","Motzei Shabbos Shiur Going to A Tzaddik for a Bracha","https://www.yutorah.org/lectures/details?shiurid=720702"
"Rabbi Ally Ehrman","When Eisav's Cry Is Heard","https://www.yutorah.org/lectures/details?shiurid=722556"
"Rabbi Chaim Brovender","Yitzchak's Wells","https://www.yutorah.org/lectures/details?shiurid=737325"
"Rabbi Ally Ehrman","Pious Or Foolish: A Study Of Esavian Deception","https://www.yutorah.org/lectures/details?shiurid=729160"
"Rabbi Eliezer Lerner","Parshat Toldot - 15 minute weekly sicha","https://www.yutorah.org/lectures/details?shiurid=781034"
"Rabbi Hanan Balk","The Greatness of Yitzchak","https://www.yutorah.org/lectures/details?shiurid=729215"
"Rabbi Avishai David","Shiur on Parshat Toldot","https://www.yutorah.org/lectures/details?shiurid=729249"
"Rabbi Avishai David","Ramban on Parshat Toldot","https://www.yutorah.org/lectures/details?shiurid=729265"
"Rabbi Meir Goldwicht","Parshat Toldot","https://www.yutorah.org/lectures/details?shiurid=729297"
"Rabbi Andi Yudin","Mussar Shmooze on Parshat Toldot","https://www.yutorah.org/lectures/details?shiurid=729398"
"Rabbi Shalom Rosner","Toldot","https://www.yutorah.org/lectures/details?shiurid=729267"
"Rabbi Baruch Simon","Toldos 5769 - ""Chafiras HaBe'eros"": Unearthing Our Essence","https://www.yutorah.org/lectures/details?shiurid=729271"
"Rabbi Hanoch Teller","Parsha Journeys: Parshat Toldot","https://www.yutorah.org/lectures/details?shiurid=729277"
"Rabbi Shmuel Marcus","Yitzchak's Pachad","https://www.yutorah.org/lectures/details?shiurid=729287"
"Rabbi Daniel Hartstein","What a Jew Smells Like","https://www.yutorah.org/lectures/details?shiurid=729599"
"Rabbi Chaim Eisenstein","Parshat Toldot - davening for rain","https://www.yutorah.org/lectures/details?shiurid=729340"
"Rabbi Binyamin Kwalwasser","Living in the Dark","https://www.yutorah.org/lectures/details?shiurid=775480"
"Rabbi Yehoshua Grunstein","# 9- Don't rely just on the Precedent [Parshat Toldot]","https://www.yutorah.org/lectures/details?shiurid=729393"
"Rabbi Ally Ehrman","Knowing What Is Important","https://www.yutorah.org/lectures/details?shiurid=729539"
"Rabbi Pinny Rosenthal","Discussions on Parshat Toldot PART 2","https://www.yutorah.org/lectures/details?shiurid=729657"
"Rabbi Pinny Rosenthal","Discussion on Parshas Toldot Part 1","https://www.yutorah.org/lectures/details?shiurid=729659"
"Rabbi Ally Ehrman","The World Of Falsehood - What It Is And How To Overcome It","https://www.yutorah.org/lectures/details?shiurid=737984"
"Rabbi David Berger","Jacob/Israel, Esau/Edom, and the True Israel in the Jewish-Christian Debate","https://www.yutorah.org/lectures/details?shiurid=738564"
"Dr. Nechama Price","Family Dynamic: Was Yitzchak Following in his Father's Footsteps?","https://www.yutorah.org/lectures/details?shiurid=746089"
"Rabbi Yehoshua Grunstein","Toldot-Don't live in the past!!","https://www.yutorah.org/lectures/details?shiurid=739042"
"Rabbi Aryeh Hendler","The Theft of the Blessings as a Background to an Educational Dispute","https://www.yutorah.org/lectures/details?shiurid=739052"
"Rabbi Jesse Horn","Avraham, Yishmael and Yitzhak - Parshas Toldos","https://www.yutorah.org/lectures/details?shiurid=739063"
"Rabbi Avishai David","The Struggle Between Yaakov and Eisav","https://www.yutorah.org/lectures/details?shiurid=739239"
"Rabbi Steven Weil","Yitzchak's Bracha To Yaakov","https://www.yutorah.org/lectures/details?shiurid=775559"
"Rabbi Moshe Weinberger","Real Prayer Transforms The Person","https://www.yutorah.org/lectures/details?shiurid=826258"
"Rabbi Ezra Schwartz","Permission to Deceive: Halachot of Lying","https://www.yutorah.org/lectures/details?shiurid=739377"
"Rabbi Shalom Hammer","Toldot: Strength of Conviction","https://www.yutorah.org/lectures/details?shiurid=739140"
"Rabbi Reuven Spolter","Parshat Toldot - Raising Different Children","https://www.yutorah.org/lectures/details?shiurid=739143"
"Rabbi Meir Lipschitz","The Sale of the Birthright","https://www.yutorah.org/lectures/details?shiurid=740825"
"Rabbi Jesse Horn","What Yaakov and Esuv were thinking when they traded the Bechorah","https://www.yutorah.org/lectures/details?shiurid=739213"
"Rabbi Baruch Simon","Toldos 5770 - Learning Even From Bad Traits","https://www.yutorah.org/lectures/details?shiurid=739215"
"Rabbi Andi Yudin","Parshas Toldos: You Are What You Say","https://www.yutorah.org/lectures/details?shiurid=739221"
"Rabbi Ephraim Greene","A Yaakov Avinu Perspective on Olam Hazeh","https://www.yutorah.org/lectures/details?shiurid=739243"
"Rabbi Chaim Eisenstein","Avimelech vs. Paroh, mitzrayim vs. Grar; study of contrasts","https://www.yutorah.org/lectures/details?shiurid=739248"
"Rabbi Michael Taubes","Pashas Toldos Kibud Av V'Em A Parent that is Mochel Their Kovod","https://www.yutorah.org/lectures/details?shiurid=739272"
"Rabbi Aaron Feigenbaum","Parshas Toldos Maaser Avos","https://www.yutorah.org/lectures/details?shiurid=739310"
"Mrs Ilana Saks","Black and White and Read Again","https://www.yutorah.org/lectures/details?shiurid=739190"
"Rabbi Aharon Kahn","The Geneology of Zera Avraham and Bris Milah - A birds eye view of Bereishis (Parashas Toldos)","https://www.yutorah.org/lectures/details?shiurid=739200"
"Rabbi Moshe Tzvi Weinberg","The Silence in the Soup","https://www.yutorah.org/lectures/details?shiurid=739537"
"Rabbi Ally Ehrman","Eisav Is Complete - Or So He Thinks","https://www.yutorah.org/lectures/details?shiurid=739222"
"Rabbi Yisroel Kaminetsky","Yitzchak's Wells","https://www.yutorah.org/lectures/details?shiurid=739259"
"Rabbi Michael Taubes","Parshas Toldos Kinyanim by common Custom","https://www.yutorah.org/lectures/details?shiurid=739286"
"Rabbi Daniel Fridman","Chosen Ones 6: The Gravitas of Yitzchak","https://www.yutorah.org/lectures/details?shiurid=739362"
"Rabbi Zev Reichman","Eisav & Yaakov - Body and Soul","https://www.yutorah.org/lectures/details?shiurid=739683"
"Rabbi Jonathan Rosenblatt","Parshat Toldot","https://www.yutorah.org/lectures/details?shiurid=775568"
"Mrs. Shira Smiles","130 Toldos Drawing Inspiration From the Wells","https://www.yutorah.org/lectures/details?shiurid=740405"
"Mrs. Shira Smiles","172 Toldot Testing the Essence","https://www.yutorah.org/lectures/details?shiurid=740443"
"Mrs. Shira Smiles","5769 70 08 toldos emerging worlds","https://www.yutorah.org/lectures/details?shiurid=740591"
"Rabbi Zev Reichman","Toldos","https://www.yutorah.org/lectures/details?shiurid=742124"
"Rabbi Mordechai Torczyner","Amos: Perek 1, Pesukim 3-12","https://www.yutorah.org/lectures/details?shiurid=743153"
"Rabbi Moshe Taragin","Parshas Toldot - Decisions Decisions","https://www.yutorah.org/lectures/details?shiurid=746627"
"Rabbi Moshe Taragin","Parshas Toldot - How Could Esav Squander the Bechora?","https://www.yutorah.org/lectures/details?shiurid=746628"
"Rabbi Ally Ehrman","Ushpizin D'Yaakov - Ish Tam V'ish Sadeh","https://www.yutorah.org/lectures/details?shiurid=747847"
"Rabbi Chaim Eisenstein","Toldot: Yitzchak and Rivka's Machloket","https://www.yutorah.org/lectures/details?shiurid=751231"
"Rabbi Eliezer Lerner","Parshat Toldot - 15 minute weekly sicha","https://www.yutorah.org/lectures/details?shiurid=781955"
"Rabbi Ari Zahtz","Parshas Toldos Yitzchaks Love for Eisav","https://www.yutorah.org/lectures/details?shiurid=751248"
"Rabbi Michael Rosensweig","The Impact of the Akeidah on Jewish Thought","https://www.yutorah.org/lectures/details?shiurid=751250"
"Rabbi Zev Reichman","Divrei Torah on Parshas Toldos","https://www.yutorah.org/lectures/details?shiurid=751350"
"Rabbi Avishai David","The Struggle Between Yaakov and Esav","https://www.yutorah.org/lectures/details?shiurid=751774"
"Rabbi Benjamin Yudin","Why is Rebbe the chosen descendant of Yaacov?","https://www.yutorah.org/lectures/details?shiurid=751993"
"Rabbi Meir Goldwicht","Parshat Toldot","https://www.yutorah.org/lectures/details?shiurid=751614"
"Rabbi Michael Olshin","Will the Real Yaakov Please Stand Up","https://www.yutorah.org/lectures/details?shiurid=751642"
"Rabbi Zev Reichman","Why did Yitzchak love Esav?","https://www.yutorah.org/lectures/details?shiurid=751466"
"Rabbi Reuven Spolter","Parshat Toldot:A Bowl of Stew and the Price of Faith","https://www.yutorah.org/lectures/details?shiurid=751602"
"Rabbi Andi Yudin","Parshas Toldos: Torah: The Heart of the Jew","https://www.yutorah.org/lectures/details?shiurid=751641"
"Rabbi Avi Schneider","Twin Challenges","https://www.yutorah.org/lectures/details?shiurid=751776"
"Rabbi Baruch Simon","Toldos 5771 - Overcoming Weakness and the Need for Brachos","https://www.yutorah.org/lectures/details?shiurid=751793"
"Rabbi Moshe Taragin","Toldos: Walking Down the Path of Others","https://www.yutorah.org/lectures/details?shiurid=751796"
"Rabbi Aryeh Lebowitz","Toldos Derasha - Bending For Ratzon Hashem","https://www.yutorah.org/lectures/details?shiurid=751800"
"Rabbi Moshe Tzvi Weinberg","Toldos 5771 - A Perfect Love- Hashem's Love for Bnei Yisrael @ CBY","https://www.yutorah.org/lectures/details?shiurid=751809"
"Rabbi Chaim Brovender","Did Esav Do Teshuva?","https://www.yutorah.org/lectures/details?shiurid=751825"
"Rabbi Chaim Eisenstein","Parshat Toldot - Gemilut chasadim and seudat havra'a","https://www.yutorah.org/lectures/details?shiurid=751831"
"Rabbi Michael Taubes","Toldos Besamim and Havdalah","https://www.yutorah.org/lectures/details?shiurid=751851"
"Rabbi David Lebor","Why is Yitzchak One of the Avot","https://www.yutorah.org/lectures/details?shiurid=751908"
"Rabbi Dovid Gottlieb","Ha'alitehu Le'Rasha Ve'yamus","https://www.yutorah.org/lectures/details?shiurid=752767"
"Rabbi Jesse Horn","Why Esuv got so mad when he lost the Bechora","https://www.yutorah.org/lectures/details?shiurid=751799"
"Rabbi Yisroel Kaminetsky","Parshat Toldot 5771: Studies in the Ramban","https://www.yutorah.org/lectures/details?shiurid=751845"
"Rabbi Michael Taubes","Parshas Toldos Wedding Minhagim and Forgiveness of Sins","https://www.yutorah.org/lectures/details?shiurid=751911"
"Rabbi Azarya Berzon","Ramban: Yitzchok and Rivka and the Brachot for their Children","https://www.yutorah.org/lectures/details?shiurid=752284"
"Rabbi Azarya Berzon","Insights into Parshat Toldot","https://www.yutorah.org/lectures/details?shiurid=752299"
"Rabbi Azarya Berzon","Selling the Birthright to Yaakov","https://www.yutorah.org/lectures/details?shiurid=752161"
"Rabbi Dovid Gottlieb","Toldot - Haliteini","https://www.yutorah.org/lectures/details?shiurid=789266"
"Rabbi Azarya Berzon","The Ramban's View on the Special Nature of the Performance of All Mitzvot in Eretz Yisrael","https://www.yutorah.org/lectures/details?shiurid=752494"
"Rabbi Ally Ehrman","Pachad Yitzchak Pesach Ma'amar 62: Gadlus Hada'as","https://www.yutorah.org/lectures/details?shiurid=760229"
"Rabbi Ari Kahn","The Relationship Of Esav And Rivka","https://www.yutorah.org/lectures/details?shiurid=844043"
"Rabbi Ari Kahn","Yishmael and Esav","https://www.yutorah.org/lectures/details?shiurid=844042"
"Rabbi Daniel Fridman","Of Fathers and Sons:וילכו שניהם יחדו","https://www.yutorah.org/lectures/details?shiurid=765659"
"Rabbi Hershel Schachter","The Importance of Finding a Rebbe","https://www.yutorah.org/lectures/details?shiurid=765893"
"Mrs. Shira Smiles","Toldos: Tumultuous Trembling","https://www.yutorah.org/lectures/details?shiurid=765986"
"Rabbi Eliezer Lerner","We need Tefilla, not Hashem","https://www.yutorah.org/lectures/details?shiurid=782865"
"Rabbi Ari Zahtz","Parshat Toldot The Bechora for Beans","https://www.yutorah.org/lectures/details?shiurid=765989"
"Rabbi Avishai David","The Vision of Yaakov","https://www.yutorah.org/lectures/details?shiurid=766029"
"Rabbi Eliezer Zwickler","Toldot: Food for Thought","https://www.yutorah.org/lectures/details?shiurid=765998"
"Rabbi Efrem Goldberg","Parshas Toldos: A Deceitful Truth","https://www.yutorah.org/lectures/details?shiurid=766001"
"Rabbi Aaron Leibtag","The Master Plan","https://www.yutorah.org/lectures/details?shiurid=766013"
"Rabbi Baruch Simon","Parshas Toldos 5772 Vayei'ater Lo Hashem - Limudim B'Kabalas HaTefillah","https://www.yutorah.org/lectures/details?shiurid=766015"
"Rabbi Yaakov B. Neuburger","Ramban Parsha Toldot","https://www.yutorah.org/lectures/details?shiurid=766027"
"Rabbi Moshe Taragin","Hypocrisy of the pigs","https://www.yutorah.org/lectures/details?shiurid=766032"
"Rabbi Zvi Romm","Ohr Hachaim on Toldot","https://www.yutorah.org/lectures/details?shiurid=766036"
"Rabbi Shay Schachter","""Baruch Sheptarani"" - Who recites and Why?","https://www.yutorah.org/lectures/details?shiurid=766138"
"Rabbi Reuven Spolter","Parshat Toldot - Internal and External Judiasm","https://www.yutorah.org/lectures/details?shiurid=766033"
"Rabbi Shalom Hammer","Toldot: National Religious and Yaakov","https://www.yutorah.org/lectures/details?shiurid=766042"
"Rabbi Andi Yudin","Thanksgiving Leads to Blessings","https://www.yutorah.org/lectures/details?shiurid=766044"
"Rabbi Chaim Brovender","Tzayid BeFiv - Tricks and Traps","https://www.yutorah.org/lectures/details?shiurid=766050"
"Rabbi Aryeh Leibowitz","Are There ""Type A"" Personalities?: Free Will and Character Traits","https://www.yutorah.org/lectures/details?shiurid=766053"
"Rabbi Shmuel Marcus","Toldos 5772","https://www.yutorah.org/lectures/details?shiurid=766098"
"Rabbi Akiva Koenigsberg","Torah Temimah Series - Toldot 1","https://www.yutorah.org/lectures/details?shiurid=766100"
"Rabbi Ephraim Greene","Toldos: Dig In!","https://www.yutorah.org/lectures/details?shiurid=766107"
"Rabbi Azarya Berzon","Parshat Toldot: Yitchok & Rivka, Esau & Yaakov, who gets the brachot and why?","https://www.yutorah.org/lectures/details?shiurid=766115"
"Rabbi Yehuda Goldschmidt","Esav's Foolish Value System","https://www.yutorah.org/lectures/details?shiurid=766111"
"Rabbi David Horwitz","Were the Patriarchs Rich?","https://www.yutorah.org/lectures/details?shiurid=766705"
"Rabbi Daniel Fridman","No Child Left Behind: Yitzchak's Deep Desire to Include Both of his Sons in the Masorah","https://www.yutorah.org/lectures/details?shiurid=766160"
"Mrs. Malke Bina","Yaakov and Esav: When Two Are One","https://www.yutorah.org/lectures/details?shiurid=766704"
"Rabbi Eli Reich","How Could Yitzchak Think Esav Should Get the Berachot","https://www.yutorah.org/lectures/details?shiurid=789261"
"Rabbi Beinish Ginsburg","Toldos- Yitzhak's role as one of the Avos","https://www.yutorah.org/lectures/details?shiurid=767423"
"Rabbi Ally Ehrman","The Koach Of Nesina","https://www.yutorah.org/lectures/details?shiurid=771745"
"Rabbi Ezra Frazer","Father Knows Best? Towards Understanding Yitzchak’s Love of Esav","https://www.yutorah.org/lectures/details?shiurid=772963"
"Rabbi Azarya Berzon","Parshet Vayeira: Lot's daughters propagate the world & defining the concept of Aveira LiShma; Parshat Chayei Sarah: Eliezer the Eved & the Ish; the words of the Torah & the expression of a person","https://www.yutorah.org/lectures/details?shiurid=783810"
"Rabbi Meir Goldwicht","Matza Isha Matza Tov: Only Good? Not Very Good?","https://www.yutorah.org/lectures/details?shiurid=783861"
"Mrs. Shira Smiles","Forgiveness and Fortitude","https://www.yutorah.org/lectures/details?shiurid=783899"
"Rabbi Eliezer Lerner","Parshat Toldot - 15 minute weekly sicha","https://www.yutorah.org/lectures/details?shiurid=783917"
"Rabbi Reuven Taragin","Parsha K'pshuta- Parashat Toldot","https://www.yutorah.org/lectures/details?shiurid=784076"
"Rabbi Moshe Taragin","The Invisible Man","https://www.yutorah.org/lectures/details?shiurid=783889"
"Rabbi Azarya Berzon","Ramban on Parshat Toldot: The symbolism and message of the wells of Avraham and Yitzchok","https://www.yutorah.org/lectures/details?shiurid=783927"
"Rabbi Joel Finkelstein","Toledot : Rivka's Age","https://www.yutorah.org/lectures/details?shiurid=783934"
"Rabbi Reuven Spolter","Parshat Toldot: Rivka, Yaakov, Eisav, and Flying Missiles","https://www.yutorah.org/lectures/details?shiurid=783939"
"Rabbi Philip Moskowitz","Hafotrah for Toldos: Leadership - You’re Either In or You’re Out","https://www.yutorah.org/lectures/details?shiurid=783968"
"Rabbi Michael Rosensweig","The Paradigms of Yaakov and Avraham vs. Eisav - Leadership without Fanfare","https://www.yutorah.org/lectures/details?shiurid=784033"
"Rabbi Avishai David","Chanoch Lna'ar Al Pi Darko","https://www.yutorah.org/lectures/details?shiurid=784126"
"Rabbi Judah Mischel","Toldot - Digging Our Own Wells","https://www.yutorah.org/lectures/details?shiurid=789263"
"Rabbi Moshe Taragin","Grab a Shovel & Daven !!","https://www.yutorah.org/lectures/details?shiurid=784007"
"Rabbi Chaim Brovender","Yaakov and Esav Revisted","https://www.yutorah.org/lectures/details?shiurid=784031"
"Rabbi Moshe Tzvi Weinberg","Kedushas Levi - Toldos 5773 - The Life Changing Experience of Seeing a True Tzaddik @ YU","https://www.yutorah.org/lectures/details?shiurid=784045"
"Rabbi Ari Ginsberg","Parshas Toldos - The Big Secret","https://www.yutorah.org/lectures/details?shiurid=800492"
"Rabbi Eli Belizon","Parshas Toledos: Financial Value in Halacha: Projections, Hedges & Futures","https://www.yutorah.org/lectures/details?shiurid=784144"
"Rabbi Michael Taubes","Parshas Toldos Bracha of Baruch ShePetarani","https://www.yutorah.org/lectures/details?shiurid=784241"
"Rabbi Moshe D. Tendler","Parshas Toldos","https://www.yutorah.org/lectures/details?shiurid=784103"
"Rabbi Ephraim Greene","Toldos: Fasting on Your Wedding Day, Lessons from Eisav's Marriage","https://www.yutorah.org/lectures/details?shiurid=784062"
"Rabbi Zvi Romm","Haemek Davar on Toldos","https://www.yutorah.org/lectures/details?shiurid=784118"
"Rabbi Baruch Simon","Toldos 5773 - The Importance of Staying Structed, Which Esav was Not","https://www.yutorah.org/lectures/details?shiurid=784110"
"Rabbi Azarya Berzon","Ramban on Parshat Toldot: Is there Judaism before Matan Torah?","https://www.yutorah.org/lectures/details?shiurid=784113"
"Rabbi Azarya Berzon","Parshat Toldot: Yitchok, Esau & Yaakov, in the writings of the Shem Mishmuel","https://www.yutorah.org/lectures/details?shiurid=784114"
"Rabbi Andi Yudin","Kibbud Av V'em to the Max","https://www.yutorah.org/lectures/details?shiurid=784127"
"Rabbi Chaim Eisenstein","Ten Minute Mussar: The Secret of Klal Yisrael - The antidote to alcoholism","https://www.yutorah.org/lectures/details?shiurid=784132"
"Rabbi Moshe Taragin","Esav's 3 Fatal Flaws","https://www.yutorah.org/lectures/details?shiurid=784124"
"Rabbi Yehuda Goldschmidt","Wake Up and Do Something","https://www.yutorah.org/lectures/details?shiurid=784130"
"Rabbi Michael Taubes","Parshas Toldos When Does One Become a Bar or Bas Mitzvah","https://www.yutorah.org/lectures/details?shiurid=784245"
"Rabbi Elchanan Adler","Weekly Halacha: Are Non-Jews obligated in kibbud av va'em?","https://www.yutorah.org/lectures/details?shiurid=784219"
"Rabbi Alan Haber","Between Esav and Lavan: Our Enemies' Many Faces","https://www.yutorah.org/lectures/details?shiurid=784388"
"Rabbi Yaacov Haber","Kedushas Shabbos Part 102 - The Sign of Mashiach","https://www.yutorah.org/lectures/details?shiurid=785298"
"Rabbi Josh Strulowitz","Marriage of Yitchak and Rivka","https://www.yutorah.org/lectures/details?shiurid=793748"
"Ms. Elana Flaumenhaft","A Portrait of Rivka: Avraham's Niece, Yitzchak's Wife, Yaakov's Mother","https://www.yutorah.org/lectures/details?shiurid=799516"
"Rabbi Meir Goldwicht","Bridging the Generation Gap: From Respecting Parents To Educating Children","https://www.yutorah.org/lectures/details?shiurid=799517"
"Rabbi Shay Schachter","Looking at a Rasha","https://www.yutorah.org/lectures/details?shiurid=799520"
"Rabbi Moshe Taragin","Act II","https://www.yutorah.org/lectures/details?shiurid=799546"
"Rabbi Eli Weber","Parshat Toldot Did the Avot Keep Taryag Mitzvot","https://www.yutorah.org/lectures/details?shiurid=799553"
"Rabbi Avishai David","Parshas Toldos","https://www.yutorah.org/lectures/details?shiurid=799611"
"Rabbi Steven Pruzansky","Midrash Parshat Toldot","https://www.yutorah.org/lectures/details?shiurid=799659"
"Rabbi Efrem Goldberg","Parshas Toldos: Yitzchak as the Paradigmatic Role Player","https://www.yutorah.org/lectures/details?shiurid=799622"
"Rabbi Yonason Sacks","Zerah vs. Ben- Understanding the Difference Between Yaakov and Esav","https://www.yutorah.org/lectures/details?shiurid=799632"
"Rabbi Moshe Taragin","Hunter and Deceiver","https://www.yutorah.org/lectures/details?shiurid=799643"
"Rabbi Jason Finkelstein","Ramban Toldos","https://www.yutorah.org/lectures/details?shiurid=799675"
"Rabbi Ari Zahtz","Ramban Toldos","https://www.yutorah.org/lectures/details?shiurid=799690"
"Rabbi Josh Strulowitz","Toldos: Why Yitzchak Chose Eisav","https://www.yutorah.org/lectures/details?shiurid=800141"
"Rabbi Dr. Jonathan Schwartz","A Point to Ponder - Toldos 5774","https://www.yutorah.org/lectures/details?shiurid=799706"
"Rabbi Moshe Teitelbaum","Pri Tzadik - Toldot","https://www.yutorah.org/lectures/details?shiurid=799742"
"Rabbi Eliakim Koenigsberg","Sichas Mussar: The Real Power Player","https://www.yutorah.org/lectures/details?shiurid=799753"
"Rabbi Chaim Brovender","Mouth Traps (Tzayid BeFiv)","https://www.yutorah.org/lectures/details?shiurid=799757"
"Rabbi Dovid Hirsch","Parshas Toldos 5774","https://www.yutorah.org/lectures/details?shiurid=799896"
"Rabbi Michael Taubes","Parshas Toldos Berachos on Smelling Fruits","https://www.yutorah.org/lectures/details?shiurid=799969"
"Rabbi Azarya Berzon","Parshat Toldot: Two approaches to ""Avraham Holid et Yitzchok"", a short Mussar Shmooze on fatherhood and on the destructive force of Cynicism","https://www.yutorah.org/lectures/details?shiurid=800064"
"Rabbi Reuven Spolter","Parshat Toldot - Blind to the Truth","https://www.yutorah.org/lectures/details?shiurid=799760"
"Rabbi Dovid Rosman","Parshas Toldos: Developing Unity","https://www.yutorah.org/lectures/details?shiurid=799769"
"Rabbi Shay Schachter","Chiyuv Kriyah Upon the Loss of Life","https://www.yutorah.org/lectures/details?shiurid=799776"
"Rabbi Avi Schneider","Parshas Toldos; On Second Thought","https://www.yutorah.org/lectures/details?shiurid=799791"
"Rabbi Aryeh Lebowitz","Toldos Derasha - Otherworldly Emes","https://www.yutorah.org/lectures/details?shiurid=799796"
"Rabbi Moshe Tzvi Weinberg","Sfas Emes - Toldos 5774 - A Love Like No Other","https://www.yutorah.org/lectures/details?shiurid=799801"
"Yishai Fleisher","Netivot Shalom Pashat Toldot (2013)","https://www.yutorah.org/lectures/details?shiurid=799803"
"Rabbi Ben Leybovich","Parshas Toldos 5774","https://www.yutorah.org/lectures/details?shiurid=799818"
"Rabbi Zvi Romm","Rabbeinu Bechayeh on Toldos","https://www.yutorah.org/lectures/details?shiurid=799838"
"Rabbi Andi Yudin","Parshas Toldos; What Was so Bad About Eisav?!","https://www.yutorah.org/lectures/details?shiurid=799846"
"Rabbi Netanel Wiederblank","What's so special of the tefillos of a tzadik ben tzadik?","https://www.yutorah.org/lectures/details?shiurid=799874"
"Rabbi Aaron Kraft","Isn't Yaakov the Truthful One?","https://www.yutorah.org/lectures/details?shiurid=800449"
